term,curie,acc,name,description,is_obsolete,replacement,replacement_acc
http://purl.obolibrary.org/obo/MPATH_814,MPATH:814,MPATH:814,focal hepatic lipidosis,Locally circumscribed regions of fatty change.,,,
http://purl.obolibrary.org/obo/MPATH_355,MPATH:355,MPATH:355,cholangiofibroma,"Develops from cholangiofibrosis, fibrosis of the biliary ducts and is only potentially malignant.",,,
http://purl.obolibrary.org/obo/MPATH_102,MPATH:102,MPATH:102,labyrinth zone defect,"Defect in size, cellular composition, function or organisation of the labyrinthine zone of the placenta.",,,
http://purl.obolibrary.org/obo/MPATH_827,MPATH:827,MPATH:827,chronic dermatitis,chronic inflammation of the skin,,,
http://purl.obolibrary.org/obo/MPATH_190,MPATH:190,MPATH:190,type I hypersensitivity,"This is manifested by localized or generalized reaction that occurs immediately (minutes) after exposure to an antigen to which the person/animal was previously sensitized. It is IgE-mediated, and mast cell activation and degranulation are hallmarks.",,,
http://purl.obolibrary.org/obo/MPATH_368,MPATH:368,MPATH:368,endocrine adenocarcinoma,obsolete.,true,,
http://purl.obolibrary.org/obo/MPATH_662,MPATH:662,MPATH:662,foreign body glossitis,,,,
http://purl.obolibrary.org/obo/MPATH_115,MPATH:115,MPATH:115,fat embolism,Occlusion of vessels caused by entry of lipid or fatty cells into the circulation. Usually following trauma.,,,
http://purl.obolibrary.org/obo/MPATH_675,MPATH:675,MPATH:675,psoriasiform dermatitis,,,,
http://purl.obolibrary.org/obo/MPATH_128,MPATH:128,MPATH:128,intra-epithelial neoplasia,"Non-invasive changes characterized by alteration in the size, shape and organization of the cellular components of an epithelial tissue. Do not confuse with developmental dysplasia MPATH:64.",,,
http://purl.obolibrary.org/obo/MPATH_422,MPATH:422,MPATH:422,lymphangiosarcoma,A malignant neoplasm derived from vascular tissue in which the neoplastic cells originate from the endothelial cells of lymphatic vessels. (M-9170/3).,,,
http://purl.obolibrary.org/obo/MPATH_688,MPATH:688,MPATH:688,aortitis,,,,
http://purl.obolibrary.org/obo/MPATH_435,MPATH:435,MPATH:435,neurofibroma,Peripheral nerve tumor consisting of chaotic arrays of wavy schwann cell bundles and fibroblasts interspersed within a matrix rich in collagen and mucopolysaccharide. (M9540/0).,,,
http://purl.obolibrary.org/obo/MPATH_270,MPATH:270,MPATH:270,adenoma,A benign epithelial neoplasm in which the tumor cells may form glands or glandlike structures. In different instances this may remain a benign tumor or progress to malignancy.,,,
http://purl.obolibrary.org/obo/MPATH_448,MPATH:448,MPATH:448,squamous cell papilloma,A benign tumor consisting of villous or arborescent outgrowths of fibrovascular stroma covered by neoplastic squamous epithelial cells.,,,
http://purl.obolibrary.org/obo/MPATH_742,MPATH:742,MPATH:742,intervertebral disk prolapse,"Rupture of the intervertebral disc, usually dorsally to compress the spinal cord, secondary to trauma.",,,
http://purl.obolibrary.org/obo/MPATH_9,MPATH:9,MPATH:9,fibrinoid necrosis,Necrosis in which the necrotic tissue shows deeply eosinophilic staining similar to that of fibrin.,,,
http://purl.obolibrary.org/obo/MPATH_70,MPATH:70,MPATH:70,fistula,An abnormal passage between two internal organs or leading from a cavity to the body surface.,,,
http://purl.obolibrary.org/obo/MPATH_283,MPATH:283,MPATH:283,intraductal carcinoma,In situ carcinoma of the mammary ductal epithelium. (M- 8500/2).,true,,
http://purl.obolibrary.org/obo/MPATH_755,MPATH:755,MPATH:755,pulmonary interstitial mineralisation,Small foci of mineralization within the interstitium between alveoli.,,,
http://purl.obolibrary.org/obo/MPATH_208,MPATH:208,MPATH:208,immunodeficiency - myeloid/phagocytic defect,Primary defect in the myeloid arm of the immune system.,,,
http://purl.obolibrary.org/obo/MPATH_502,MPATH:502,MPATH:502,monocytic leukaemia,Leukaemia in which neoplastic cells are poorly or moderately differentiated with a monocytic but no neutrophilic component. At least 20% of the cells must be blasts.,,,
http://purl.obolibrary.org/obo/MPATH_83,MPATH:83,MPATH:83,septation defect,Any defect in the formation of septae not describable as perforation.,,,
http://purl.obolibrary.org/obo/MPATH_296,MPATH:296,MPATH:296,papillary adenoma,"A benign neoplasm derived from a glandular epithelium, in which solid tumors show papillary structures projecting onto fibrovascular stroma. (M-8260/0).",,,
http://purl.obolibrary.org/obo/MPATH_590,MPATH:590,MPATH:590,fibro-osseous lesion,Lesion of bone showing accelerated osteoclastic bone resorption coupled with fibroplasia. Later stages show proliferation of osteoblasts.,,,
http://purl.obolibrary.org/obo/MPATH_768,MPATH:768,MPATH:768,septic necrosis,Necrosis associated with or caused by local bacterial infection.,,,
http://purl.obolibrary.org/obo/MPATH_515,MPATH:515,MPATH:515,Non-Lymphoid neoplasias,Hematological neoplasias of non-lymphoid origin.,,,
http://purl.obolibrary.org/obo/MPATH_96,MPATH:96,MPATH:96,hypoplastic ventricle,Reduction in cell number of one or both of the two lower chambers of the heart.,,,
http://purl.obolibrary.org/obo/MPATH_528,MPATH:528,MPATH:528,classic Burkitt lymphoma,"Highly proliferative B-cell lymphoma characteristically seen in c-Myc transgenic mice, derived from mature B cells.",,,
http://purl.obolibrary.org/obo/MPATH_822,MPATH:822,MPATH:822,hypoplastic gut associated lymphoid tissue,Reduced mass of GALT resulting form fewer cells.,,,
http://purl.obolibrary.org/obo/MPATH_363,MPATH:363,MPATH:363,mesonephric tumor,Tumor beleived to be derived from mesonephric remnants. (M-8310/3).,,,
http://purl.obolibrary.org/obo/MPATH_110,MPATH:110,MPATH:110,embolus,A plug formed from a variety of materials occluding a vessel or tube.,,,
http://purl.obolibrary.org/obo/MPATH_835,MPATH:835,MPATH:835,acute septic inflammation,acute inflammation due to infection.,,,
http://purl.obolibrary.org/obo/MPATH_376,MPATH:376,MPATH:376,neuroblastoma,"A malignant neoplasm characterized by immature, poorly differentiated nerve cells of embryonic type. (M-9500/3).",,,
http://purl.obolibrary.org/obo/MPATH_670,MPATH:670,MPATH:670,granulomatous epicarditis,"A mixed inflammatory cell infiltrate, primarily macrophages and some syncitial cells, around the heart attached to the epicardium.",,,
http://purl.obolibrary.org/obo/MPATH_123,MPATH:123,MPATH:123,purpura,Purple and variously colored lesions caused by extensive haemorrhage into the skin through ecchymoses/petechia.,,,
http://purl.obolibrary.org/obo/MPATH_848,MPATH:848,MPATH:848,effacing granuloma,Replacement of normal tissue by granuloma.,,,
http://purl.obolibrary.org/obo/MPATH_389,MPATH:389,MPATH:389,chondroblastoma,"A benign or malignant neoplasm occuring in the epiphyses of long bones, consisting of highly cellular tissue resembling embryonic cartilage. (M-9230/0, /3).",,,
http://purl.obolibrary.org/obo/MPATH_683,MPATH:683,MPATH:683,degenerative arthritis,,,,
http://purl.obolibrary.org/obo/MPATH_136,MPATH:136,MPATH:136,fibroepithelial polyp,A polypoid outgrowth of both epidermis and dermal fibrovascular tissue.,,,
http://purl.obolibrary.org/obo/MPATH_430,MPATH:430,MPATH:430,angiomyxoma,"Angiomyxoma is a poorly circumscribed, slowly growing lesion composed of spindle-shaped and stellate cells evenly distributed in an abundant myxoid matrix. The lesion contains numerous vessels, often showing some hyalinization of their walls, and occasionally surrounded by a few smooth muscle cells. Immunohistochemically, tumor cells may express desmin and/ or smooth muscle actin (M-8841/1).",,,
http://purl.obolibrary.org/obo/MPATH_608,MPATH:608,MPATH:608,abscess,A circumscribed collection of purulent exudate frequently associated with swelling and other signs of inflammation.,,,
http://purl.obolibrary.org/obo/MPATH_696,MPATH:696,MPATH:696,spindle cell hyperplasia,,,,
http://purl.obolibrary.org/obo/MPATH_149,MPATH:149,MPATH:149,squamous hyperplasia,"Benign proliferation of epidermal cells with hyperkeratosis. Variable growth pattern, regular to papillary (exophytic squamous cell hyperplasia).",,,
http://purl.obolibrary.org/obo/MPATH_443,MPATH:443,MPATH:443,inverted squamous papilloma,A benign tumor consisting of villous or arborescent outgrowths of fibrovascular stroma covered by neoplastic epithelial cells in which proliferating epithelium is invaginated beneath the surface and is more smoothly rounded. (M-8053/0).,,,
http://purl.obolibrary.org/obo/MPATH_4,MPATH:4,MPATH:4,necrosis,"Morpholological changes after intravital (Pathologic) death of one or more cells, or of a portion of tissue or organ, resulting from irreversible damage;characterised by mitochondrial swelling, nuclear pyknosis, karyolysis, swollen and abnormally pale basophilic staining; or karyorrhexis, rupture and fragmentation of the nucleus. Energy independent cf. Apoptosis MPATH 3.",,,
http://purl.obolibrary.org/obo/MPATH_456,MPATH:456,MPATH:456,hydatidiform mole,Vesicular or cystic tumor with hydropic villi resulting from the proliferation of trophoblast in the absence ( complete) or the presence ( partial) of an embryo. Most complete moles are homozygous androgenetic XX 46.(M-9100/0).,,,
http://purl.obolibrary.org/obo/MPATH_750,MPATH:750,MPATH:750,pulmonary adenomatosis,Neoplastic proliferation of cuboidal cells lining alveoli most likely type II pneumocytes.,,,
http://purl.obolibrary.org/obo/MPATH_291,MPATH:291,MPATH:291,medullary carcinoma,Derived from calcitonin-producing cells (thyroid). In humans a type of carcinoma composed of epithelial elements with considerable lymphoid stroma (breast). Not yet reported in mice. (M-8510/3).,,,
http://purl.obolibrary.org/obo/MPATH_469,MPATH:469,MPATH:469,symmetry defect,Any aberration of the normal symmetrical organisation of the body pattern.,,,
http://purl.obolibrary.org/obo/MPATH_763,MPATH:763,MPATH:763,sialocele,Salivary gland duct occlusion resulting in massive enlargement forming a large cyst-like structure.,,,
http://purl.obolibrary.org/obo/MPATH_216,MPATH:216,MPATH:216,necrotic inflammation,Acute inflammatory reaction in which the predominant histological change is rapid diffuse necrosis throughout the affected tissue.,,,
http://purl.obolibrary.org/obo/MPATH_510,MPATH:510,MPATH:510,myeloid proliferations (non-reactive),Non-reactive persistent accumulation of non-lymphoid haematopoietic cells. Genetically determined.,,,
http://purl.obolibrary.org/obo/MPATH_91,MPATH:91,MPATH:91,arteriovenous anastomosis,Formation of vessels between arterioles and venules bypassing capillary circulation.,,,
http://purl.obolibrary.org/obo/MPATH_776,MPATH:776,MPATH:776,spermatocoele,A spermatocoele is a cyst that contains spermatozoa. .,,,
http://purl.obolibrary.org/obo/MPATH_229,MPATH:229,MPATH:229,sebaceous adenocarcinoma,"Malignant neoplasm of the sebaceous cells - rare areas of differentiation, severe nuclear atypia (M-8410/3).",,,
http://purl.obolibrary.org/obo/MPATH_16,MPATH:16,MPATH:16,myxoid/myxomatous degeneration,A conversion of the connective tissues into a gelatinous or mucous substance.,,,
http://purl.obolibrary.org/obo/MPATH_523,MPATH:523,MPATH:523,Diffuse large B-cell lymphoma,Diffuse proliferation of large B lymphoid cells.,,,
http://purl.obolibrary.org/obo/MPATH_789,MPATH:789,MPATH:789,trichogranuloma,Dermal granuloma surrounding hair fibers.,,,
http://purl.obolibrary.org/obo/MPATH_29,MPATH:29,MPATH:29,cataract,Opacity of the lens.,,,
http://purl.obolibrary.org/obo/MPATH_536,MPATH:536,MPATH:536,precursor T-cell neoplasms,Neoplasms of precursor T cells.,,,
http://purl.obolibrary.org/obo/MPATH_830,MPATH:830,MPATH:830,regeneration,"repair, reproduction, or replacement of lost or injured cells, tissues, or organs.",,,
http://purl.obolibrary.org/obo/MPATH_371,MPATH:371,MPATH:371,small cell carcinoma,"Neuroendocrine cell derived anaplastic carcinoma composed of small cells, usually of the lung producing a variety of peptide hormones. (M-8041/3). 1.2.3.4 of MMHCC classification.",,,
http://purl.obolibrary.org/obo/MPATH_549,MPATH:549,MPATH:549,carcinoma,"Any of various types of malignant neoplasm derived from epithelial cells, chiefly glandular (adenocarcinoma) or squamous (squamous cell carcinoma).",,,
http://purl.obolibrary.org/obo/MPATH_843,MPATH:843,MPATH:843,stasis,Cessation of movement of a body fluid or liquid.,,,
http://purl.obolibrary.org/obo/MPATH_384,MPATH:384,MPATH:384,cementoma,Reactive fibro-osseous lesion derived from odotongenic cells in the periodontal ligament (M-9272/0).,,,
http://purl.obolibrary.org/obo/MPATH_131,MPATH:131,MPATH:131,moderate intra-epithelial epithelial neoplasia,Moderate non-invasive changes in cell morphology and tissue architecture confined to the epithelium alone.,,,
http://purl.obolibrary.org/obo/MPATH_856,MPATH:856,MPATH:856,bullous emphysema,Rupture of alveolar walls result in large rounded open air spaces in the lung,,,
http://purl.obolibrary.org/obo/MPATH_309,MPATH:309,MPATH:309,gonadal tumor,Germ cell and non-germ cell tumors of the testis and ovary.,,,
http://purl.obolibrary.org/obo/MPATH_603,MPATH:603,MPATH:603,pathological anatomical entity,Anatomically located instance of pathological response or entity.,,,
http://purl.obolibrary.org/obo/MPATH_397,MPATH:397,MPATH:397,osteosarcoma,"Malignant neoplasm derived form mesenchymal stem cells, osteoblasts or osteocytes. Highly invasive and destructive tumor rising in the skeleton with osteoid and immature woven bone. (M-9180/3).",,,
http://purl.obolibrary.org/obo/MPATH_691,MPATH:691,MPATH:691,pustule,,,,
http://purl.obolibrary.org/obo/MPATH_144,MPATH:144,MPATH:144,myoepithelial hyperplasia,Benign proliferation of glandular myoepithelial cells.,,,
http://purl.obolibrary.org/obo/MPATH_869,MPATH:869,MPATH:869,intussception,"Condition in which a part of the intestine has invaginated into another section of intestine,",,,
http://purl.obolibrary.org/obo/MPATH_616,MPATH:616,MPATH:616,hyperostosis,Hypertrophy of bone characterised by an abnormal increase in non-neoplastic skeletal bone mass. These may be proliferative or non-proliferative lesions.,,,
http://purl.obolibrary.org/obo/MPATH_157,MPATH:157,MPATH:157,pseudoepithelioma/pseudocarcinoma,Benign hyperplasia and down-growth of epidermal cells. Microscopically resembling well-differentiated squamous cell carcinoma.,,,
http://purl.obolibrary.org/obo/MPATH_451,MPATH:451,MPATH:451,transitional cell carcinoma,Malignant neoplasm of transitional cells (M-8120/3).,,,
http://purl.obolibrary.org/obo/MPATH_629,MPATH:629,MPATH:629,cavernous hemangioma,Deep cutaneous hemangioma with large dilated vascular spaces that manifests spontaneous involution.,,,
http://purl.obolibrary.org/obo/MPATH_464,MPATH:464,MPATH:464,cataract; lens extrusion,"Involves capsular rupture usually of the posterior lens capsule, close to birth or in the first few weeks postpartum. Cortical material spills into the vitreous humor and may be disseminated through the eye.",,,
http://purl.obolibrary.org/obo/MPATH_211,MPATH:211,MPATH:211,failed transfer of maternal immunoglobulin,Defect in the immune system subsequent to failure to attain passive immunity from maternal transfer of immunoglobulins.,,,
http://purl.obolibrary.org/obo/MPATH_771,MPATH:771,MPATH:771,abnormal organ length,Abnormality of extent of the normal long axis,,,
http://purl.obolibrary.org/obo/MPATH_477,MPATH:477,MPATH:477,choristoma,"Similar to hamartoma, including the mass lesion requirement, but unlike hamartoma, includes heterotopic tissue of an adult or embryonic nature ( topographical and developmental anomaly).",,,
http://purl.obolibrary.org/obo/MPATH_224,MPATH:224,MPATH:224,clear cell hidradenoma,Tumor derived from eccrine sweat glands composed of clear glycogen rich cells. ( M-84020 ).,,,
http://purl.obolibrary.org/obo/MPATH_11,MPATH:11,MPATH:11,hemorrhagic necrosis,Necrosis associated with local hemorrhage.,,,
http://purl.obolibrary.org/obo/MPATH_784,MPATH:784,MPATH:784,follicular atresia,Degeneration and resorption of an ovarian follicle before it reaches maturity and ruptures.,,,
http://purl.obolibrary.org/obo/MPATH_237,MPATH:237,MPATH:237,angiokeratoma,An intradermal capillary telangiectasis with hyperkeratosis and acanthosis (M-9141/0).,,,
http://purl.obolibrary.org/obo/MPATH_24,MPATH:24,MPATH:24,plasma membrane defect,Defect in the structure or function of the plasma membrane.,,,
http://purl.obolibrary.org/obo/MPATH_531,MPATH:531,MPATH:531,B-natural killer cell lymphoma,Unusual lymphoma type described in thymectomised (SL/Kh x AKR/Ms) F1 mice. No equivalent found in human to date. See reference for detailed phenotype.,,,
http://purl.obolibrary.org/obo/MPATH_709,MPATH:709,MPATH:709,alveolar rhabdomyosarcoma,"Malignant tumor of striated muscle or pluripotential mesenchymal stem cells composed mainly of small round cells, with some partial skeletal muscle differentiation.",,,
http://purl.obolibrary.org/obo/MPATH_797,MPATH:797,MPATH:797,spermatogenesis defect,Compromise or abnormality of the process of spermatogenesis,,,
http://purl.obolibrary.org/obo/MPATH_37,MPATH:37,MPATH:37,ceroid deposition,"Intracellular deposition of golden or yellow-brown pigment, acid fast and insoluble in lipid solvents. Believed to be a type of lipofuscin.",,,
http://purl.obolibrary.org/obo/MPATH_544,MPATH:544,MPATH:544,hepatocholangiocellular adenoma,Benign tumor of unknown origin showing features of hepatocelluar adenoma and cholangioma.,,,
http://purl.obolibrary.org/obo/MPATH_557,MPATH:557,MPATH:557,aberrant crypt foci,"Sensu gastrointsestinal tract. visible microscopically in whole mount colonic tissue. One or more crypts larger than most, have a thickened layer of epithelial cells that stain more intensely with methylene blue. Some have a slit shaped luminal opening, and increased pericryptal space and are elevated from the focal plane of the microscope. ACF is not a histologic diagnosis.",true,,
http://purl.obolibrary.org/obo/MPATH_851,MPATH:851,MPATH:851,auricular deformation,acquired dysmorphology of the external pinna following trauma or infection.,,,
http://purl.obolibrary.org/obo/MPATH_304,MPATH:304,MPATH:304,serous adenocarcinoma,Adenocarcinoma from a serous gland producing and containing serous proteinaceous secretions (M-8441/3).,,,
http://purl.obolibrary.org/obo/MPATH_392,MPATH:392,MPATH:392,chondrosarcoma,"Malignant neoplasm derived form pluripotential mesenchymal cells, chondrocytes or chondroblasts. No production of osteoid. (M-9220/3).",,,
http://purl.obolibrary.org/obo/MPATH_864,MPATH:864,MPATH:864,otitis externa,Inflammation of the outer ear.,,,
http://purl.obolibrary.org/obo/MPATH_317,MPATH:317,MPATH:317,seminoma,Tumor derived from spermatogenic cells resembling spermatogenia or spermatocytes. NOS ( M9061/3).,,,
http://purl.obolibrary.org/obo/MPATH_611,MPATH:611,MPATH:611,glossitis,Acute or chronic inflammation of the tongue.,,,
http://purl.obolibrary.org/obo/MPATH_152,MPATH:152,MPATH:152,basal cell hyperplasia,Benign proliferation of the basal layer cells of the skin.,,,
http://purl.obolibrary.org/obo/MPATH_877,MPATH:877,MPATH:877,pneumonia,"An inflammatory condition of the lung, especially affecting the alveoli, associated with fever, chest symptoms, and congestion.",,,
http://purl.obolibrary.org/obo/MPATH_624,MPATH:624,MPATH:624,involution,Turning in of the edges of a structure.,,,
http://purl.obolibrary.org/obo/MPATH_165,MPATH:165,MPATH:165,glandular metaplasia,Development of heterotopic glandular epithelia.,,,
http://purl.obolibrary.org/obo/MPATH_637,MPATH:637,MPATH:637,bursal cyst,"A retention cyst, resulting from an obstruction to the duct of a gland, within a bursa.",,,
http://purl.obolibrary.org/obo/MPATH_178,MPATH:178,MPATH:178,extracellular matrix deposition,Abnormal deposition of extracellular matrix proteins or other components.,,,
http://purl.obolibrary.org/obo/MPATH_472,MPATH:472,MPATH:472,Dorsal/ventral axis defect,Dorsoventral aberration of the normal symmetrical organisation of the body pattern.,,,
http://purl.obolibrary.org/obo/MPATH_232,MPATH:232,MPATH:232,trichoepithelioma,Multiple small benign nodules derived from basal cells of hair follicles enclosing small cornified cell containing cysts. (M-8100/0).,,,
http://purl.obolibrary.org/obo/MPATH_704,MPATH:704,MPATH:704,thyroiditis,,,,
http://purl.obolibrary.org/obo/MPATH_498,MPATH:498,MPATH:498,myeloid leukaemia with maturation,Leukaemia in which neoplastic cells are moderately differentiated with a neutrophilic but not monocytic component. At least 20% of the cells have to be blasts.,,,
http://purl.obolibrary.org/obo/MPATH_792,MPATH:792,MPATH:792,lymph node reticuloendothelial cell hyperplasia,Proliferation of the reticuloendothelial cells in the medulla of the lymph node.,,,
http://purl.obolibrary.org/obo/MPATH_32,MPATH:32,MPATH:32,glaucoma,Increase in the intraocular pressure.,,,
http://purl.obolibrary.org/obo/MPATH_245,MPATH:245,MPATH:245,choroid plexus carcinoma,Malignant neoplasm derived from the epithelial cells of the choroid plexus. (M-9390/3).,,,
http://purl.obolibrary.org/obo/MPATH_717,MPATH:717,MPATH:717,sequestrum,,,,
http://purl.obolibrary.org/obo/MPATH_258,MPATH:258,MPATH:258,mesodermal mixed tumor,"Neoplasm showing multiple phases, derived from mesoderm (M-8951/3).",,,
http://purl.obolibrary.org/obo/MPATH_45,MPATH:45,MPATH:45,protein deposition,Non-specified intra or extracellular deposition of protein.,,,
http://purl.obolibrary.org/obo/MPATH_552,MPATH:552,MPATH:552,Clara cell adenoma,Benign tumor of the Clara cells of the bronchioalveolar epithelium.,true,,
http://purl.obolibrary.org/obo/MPATH_58,MPATH:58,MPATH:58,aplasia,"Absence of an organ or tissue coupled with persistence of the organ/tissue primordium, which fails to develop completely.",,,
http://purl.obolibrary.org/obo/MPATH_565,MPATH:565,MPATH:565,tumors of neurepithelial tissue,Tumors of neuronal and non-neuronal cells derived from embryonic neurepithelium.,,,
http://purl.obolibrary.org/obo/MPATH_578,MPATH:578,MPATH:578,trichoblastoma,Basaloid neoplasm with frequent primitive hair follicles.,,,
http://purl.obolibrary.org/obo/MPATH_872,MPATH:872,MPATH:872,kyphosis,Abnormality of the kyphotic curvature of the spine.,,,
http://purl.obolibrary.org/obo/MPATH_325,MPATH:325,MPATH:325,fibrothecoma,obsolete use thecoma MPATH:334.,true,,
http://purl.obolibrary.org/obo/MPATH_160,MPATH:160,MPATH:160,metaplasia,Abnormal transformation of an fully differentiated adult cell or tissue of one kind into a differentiated tissue of another kind. An adult instance of developmental transdifferentiation MPATH:85 Traditionally defined as a form of abnormal regeneration in which a type of cell different from that found normally in a given location is produced.,,,
http://purl.obolibrary.org/obo/MPATH_885,MPATH:885,MPATH:885,metastatic tumor,metastatic tumour of unspecified origin,,,
http://purl.obolibrary.org/obo/MPATH_632,MPATH:632,MPATH:632,Hepatocytomegaly,Increase in size of hepatocytes characterised by organelle hyperplasia and enlarged cellular volume.,,,
http://purl.obolibrary.org/obo/MPATH_173,MPATH:173,MPATH:173,myeloid metaplasia,A progressive disease of the bone marrow where neoplastic bone marrow stem cells lodge and grow at sites outside the bone marrow.,,,
http://purl.obolibrary.org/obo/MPATH_645,MPATH:645,MPATH:645,epicarditis,,,,
http://purl.obolibrary.org/obo/MPATH_186,MPATH:186,MPATH:186,complete parenchymal regeneration,Complete healing through parenchymal regeneration - no fibrosis.,,,
http://purl.obolibrary.org/obo/MPATH_480,MPATH:480,MPATH:480,decidual defect,"Any defect in the formation, architecture, cellular composition or function of the maternal decidua.",,,
http://purl.obolibrary.org/obo/MPATH_658,MPATH:658,MPATH:658,foreign body rhinitis,,,,
http://purl.obolibrary.org/obo/MPATH_405,MPATH:405,MPATH:405,chordoma,Believed to arise from primitive notochord remnants . Usually occurs along the axial skeleton and is characterised by the presence of bubble cells containing large unstained cytoplasmic vacuoles with central or eccentricc nuclei. Benign but locally invasive. (M-9370/3).,,,
http://purl.obolibrary.org/obo/MPATH_199,MPATH:199,MPATH:199,immune mediated thrombocytopenia,A condition resulting from an increased rate of immune mediated platelet destruction.,,,
http://purl.obolibrary.org/obo/MPATH_493,MPATH:493,MPATH:493,membraneoproliferative glomerulonephritis,"A chronic glomerulonephritis characterized by mesangial cell proliferation, increased lobular separation of glomeruli, thickening of glomerular capillary walls and increased mesangial matrix,.",,,
http://purl.obolibrary.org/obo/MPATH_240,MPATH:240,MPATH:240,hemangioma,Neoplasm derived from endothelial cells. May be of capillary or cavernous type with large vascular channels. (M-9130/0 + M-9120/0 respectively).,,,
http://purl.obolibrary.org/obo/MPATH_418,MPATH:418,MPATH:418,liposarcoma,Malignant neoplasms which probably originate in primitive mesenchymal stem cell populations differentiating down a lipomatous pathway. (M-8850/3).,,,
http://purl.obolibrary.org/obo/MPATH_712,MPATH:712,MPATH:712,heterotaxy,,,,
http://purl.obolibrary.org/obo/MPATH_253,MPATH:253,MPATH:253,sub-ependymoma,Neoplasm derived from sub-ependymal astrocytes (M-9383/1).,,,
http://purl.obolibrary.org/obo/MPATH_40,MPATH:40,MPATH:40,hyalinosis,Intracellular deposition of eosinophilic material.,,,
http://purl.obolibrary.org/obo/MPATH_725,MPATH:725,MPATH:725,chronic interstitial nephritis,,,,
http://purl.obolibrary.org/obo/MPATH_266,MPATH:266,MPATH:266,fibroadenoma,"A benign neoplasm derived from glandular epithelium, in which there is a abundant stroma of proliferating fibroblasts and connective tissue. (M-9010/0).",,,
http://purl.obolibrary.org/obo/MPATH_53,MPATH:53,MPATH:53,osteopenia,"Reduced bone mass due to inadequate synthesis of osteoid, resulting in decreased calcification.",,,
http://purl.obolibrary.org/obo/MPATH_560,MPATH:560,MPATH:560,cribriform adenocarcinoma,"Tumor composed of sheets or nests of cells forming lumens with round, punched out spaces.",,,
