term,curie,acc,name,description,is_obsolete,replacement,replacement_acc
http://purl.obolibrary.org/obo/MPATH_738,MPATH:738,MPATH:738,uterine cystic endometrial hyperplasia,,,,
http://purl.obolibrary.org/obo/MPATH_66,MPATH:66,MPATH:66,dilatation,Increase in the diameter of an orifice or tubular structure beyond its normal dimensions.,,,
http://purl.obolibrary.org/obo/MPATH_279,MPATH:279,MPATH:279,follicular adenoma,"Adenoma derived from the follicular cells of the thyroid follicles. Follicular, paipillary and solid forms. M- 8330/0.",,,
http://purl.obolibrary.org/obo/MPATH_573,MPATH:573,MPATH:573,inverted transitional cell papilloma,"Pre-malignant lesion of transitional cells, papillomatous form, in which proliferating epithelium is invaginated beneath the surface.",,,
http://purl.obolibrary.org/obo/MPATH_320,MPATH:320,MPATH:320,struma ovarii,"Rare ovarian tumor, regarded as monodermal teratoma, in which thyroid tissue has surpassed the other elements; occasionally associated with hyperthyroidism (M-9090/0).",,,
http://purl.obolibrary.org/obo/MPATH_79,MPATH:79,MPATH:79,malposition,Abnormal position or orientation of a structure insufficient to be called a heterotopia.,,,
http://purl.obolibrary.org/obo/MPATH_586,MPATH:586,MPATH:586,polycystic disease,A group of degenerative disorders resulting in multiple cysts in tissues.,,,
http://purl.obolibrary.org/obo/MPATH_880,MPATH:880,MPATH:880,foreign body gingivitis,inflammation of the tooth gum caused by a foreign body.,,,
http://purl.obolibrary.org/obo/MPATH_805,MPATH:805,MPATH:805,cystic hygroma,Variant of cavernous lymphangioma (MPATH:804) showing gross dilatation of lymphatic channels.,,,
http://purl.obolibrary.org/obo/MPATH_346,MPATH:346,MPATH:346,autoimmune mediated disease,,,,
http://purl.obolibrary.org/obo/MPATH_640,MPATH:640,MPATH:640,osteoid deposition,Deposition of organic bone matrix.,,,
http://purl.obolibrary.org/obo/MPATH_818,MPATH:818,MPATH:818,focal pulmonary histiocytosis,,,,
http://purl.obolibrary.org/obo/MPATH_181,MPATH:181,MPATH:181,fibrosis,Reactive formation of fibrous tissue.,,,
http://purl.obolibrary.org/obo/MPATH_359,MPATH:359,MPATH:359,melanoma,"Tumor of neurectodermal origin, usually melanocytes, showing dense deposition of melanin granules, although amelanotic melanomas have been reported. (M-8720/3).",,,
http://purl.obolibrary.org/obo/MPATH_653,MPATH:653,MPATH:653,langerhans cell histiocytosis,,,,
http://purl.obolibrary.org/obo/MPATH_106,MPATH:106,MPATH:106,fluid accumulation,Abnormal accumulation of fluid; blood or lymph.,,,
http://purl.obolibrary.org/obo/MPATH_400,MPATH:400,MPATH:400,carotid body tumor,Paraganglioma arising in the CHIEF cells of the carotid body (M-8692/1).,,,
http://purl.obolibrary.org/obo/MPATH_194,MPATH:194,MPATH:194,immune mediated disease,Tissue response to inappropriate immune/inflammatory process.,,,
http://purl.obolibrary.org/obo/MPATH_666,MPATH:666,MPATH:666,periodontitis,,,,
http://purl.obolibrary.org/obo/MPATH_119,MPATH:119,MPATH:119,hemorrhage and non-specified extravasation,Abnormal release of whole blood or the cellular component from the circulation.,,,
http://purl.obolibrary.org/obo/MPATH_679,MPATH:679,MPATH:679,urocystitis,,,,
http://purl.obolibrary.org/obo/MPATH_426,MPATH:426,MPATH:426,leiomyosarcoma,Malignant tumor derived form pluripotential mesenchymal stem cells or smooth muscle cells. (M- 8890/3).,,,
http://purl.obolibrary.org/obo/MPATH_720,MPATH:720,MPATH:720,situs inversus,,,,
http://purl.obolibrary.org/obo/MPATH_261,MPATH:261,MPATH:261,nephroblastoma,"Embryonal tumor thought to be derived from metanephric blastema. Mono, bi or triphasic, sometimes with heterotypic differentiation. (M-8960/3).",,,
http://purl.obolibrary.org/obo/MPATH_439,MPATH:439,MPATH:439,synovial-like tumor,Neoplasms of synovial origin.,,,
http://purl.obolibrary.org/obo/MPATH_733,MPATH:733,MPATH:733,mucometra,A uterus distended with a fluid containing large quantities of mucin.,,,
http://purl.obolibrary.org/obo/MPATH_61,MPATH:61,MPATH:61,curvature defect,Inappropriate curvature of a structure.,,,
http://purl.obolibrary.org/obo/MPATH_274,MPATH:274,MPATH:274,clear cell adenocarcinoma,An adenocarcinoma characterised by the presence of varying combinations of clear and hobnail-shaped tumor cells. (M-8310/3).,,,
http://purl.obolibrary.org/obo/MPATH_746,MPATH:746,MPATH:746,cartilagenous erosion,Fragmentation and erosion of articular cartilage.,,,
http://purl.obolibrary.org/obo/MPATH_74,MPATH:74,MPATH:74,hamartoma,"A focal malformation resembling a neoplasm which results from faulty development of an organ; composed of an abnormal mixture of tissue elements, or an abnormal proportion of a single element. Growth and location are usually normal for that tissue cf. Heterotopia/Choristoma MPATH:76/MPATH:477.",,,
http://purl.obolibrary.org/obo/MPATH_287,MPATH:287,MPATH:287,islet cell adenoma,Usually pancreatic B cell derived tumors mostly producing insulin. (M- 8150/0).,,,
http://purl.obolibrary.org/obo/MPATH_581,MPATH:581,MPATH:581,desmoplasia,Connective tissue proliferative reaction induced by a neoplastic process.,,,
http://purl.obolibrary.org/obo/MPATH_759,MPATH:759,MPATH:759,pseudocyesis,Appearance of clinical and/or subclinical signs and symptoms associated with pregnancy when the animal is not pregnant,,,
http://purl.obolibrary.org/obo/MPATH_800,MPATH:800,MPATH:800,intervertebral disk prolapse dorsal,Dorsal prolapse of the intervertebral disk.,,,
http://purl.obolibrary.org/obo/MPATH_87,MPATH:87,MPATH:87,germ cell defect,"Abnormal morphology, differentiation or location of primordial germ cells or their descendents. Not neoplastic.",,,
http://purl.obolibrary.org/obo/MPATH_594,MPATH:594,MPATH:594,cystic hyperplasia,Formation of multiple retention cysts from obstruction of ducts or glands by hyperplasia of the lining epithelium.,,,
http://purl.obolibrary.org/obo/MPATH_341,MPATH:341,MPATH:341,myelodysplastic disorder,Haematopoietic proliferation with evidence of trilineage dysplasia. Less than 20% should be blasts.,,,
http://purl.obolibrary.org/obo/MPATH_519,MPATH:519,MPATH:519,Mature B-cell neoplasms,Lymphomas originating in peripheral B cells.,,,
http://purl.obolibrary.org/obo/MPATH_813,MPATH:813,MPATH:813,epidermolysis bullosa lesions,Lesions of a connective tissue disease causing blisters in the skin and mucosal membranes.,,,
http://purl.obolibrary.org/obo/MPATH_354,MPATH:354,MPATH:354,cholangiocarcinoma,Malignant tumor derived from the bile duct epithelium. (M8160/3).,,,
http://purl.obolibrary.org/obo/MPATH_101,MPATH:101,MPATH:101,glycogen cell defect,"Lack of, displacement of, or abnormality in function or growth of the glycogen cells.",,,
http://purl.obolibrary.org/obo/MPATH_826,MPATH:826,MPATH:826,granulomatous dermatitis,granulomatous inflammation of the skin,,,
http://purl.obolibrary.org/obo/MPATH_367,MPATH:367,MPATH:367,carcinoid tumor,Carcinoid tumors are of neuroendocrine origin and derived from primitive stem cells. Found predominantly in the lung and gut they are capable of secreting a large range of substances and have a number of histological subtypes. May resemble but are distinct from small cell lung carcinoma in the lung. (M-8240/3).,,,
http://purl.obolibrary.org/obo/MPATH_661,MPATH:661,MPATH:661,foreign body gastritis,,,,
http://purl.obolibrary.org/obo/MPATH_114,MPATH:114,MPATH:114,bone marrow embolism,"Occlusion of vessels caused by entry of bone marrow, often fatty debris into the circulation. Usually following trauma.",,,
http://purl.obolibrary.org/obo/MPATH_839,MPATH:839,MPATH:839,anaplastic hepatocellular carcinoma,anaplastic carcinoma of the liver.,,,
http://purl.obolibrary.org/obo/MPATH_674,MPATH:674,MPATH:674,osteomyelitis,,,,
http://purl.obolibrary.org/obo/MPATH_127,MPATH:127,MPATH:127,atrophy,"A reduction in size of organs or tissues as a result of cell death, loss of cellularity of whatever cause, reduced cellular proliferation or decreased cellular volume.",,,
http://purl.obolibrary.org/obo/MPATH_421,MPATH:421,MPATH:421,lymphangiomyomatosis,"Characterized by benign peribronchial, perivascular, and perilymphatic proliferation of atypical smooth muscle resulting in vascular and airway obstruction, cyst formation, and a progressive decline in lung function. (M- 9174/1).",,,
http://purl.obolibrary.org/obo/MPATH_687,MPATH:687,MPATH:687,autoamputation,,,,
http://purl.obolibrary.org/obo/MPATH_447,MPATH:447,MPATH:447,squamous cell carcinoma in situ,Pre-neoplastic intraepithelial lesion of squamous cells (M-8070/2).,,,
http://purl.obolibrary.org/obo/MPATH_741,MPATH:741,MPATH:741,splenomegaly,An increase in size of the spleen.,,,
http://purl.obolibrary.org/obo/MPATH_8,MPATH:8,MPATH:8,fat necrosis,"Dead and dying adipose tissue, characterized by the formation of small gray or white foci of soapy (saponified) cellular debris.",,,
http://purl.obolibrary.org/obo/MPATH_282,MPATH:282,MPATH:282,infiltrating duct carcinoma,Derived from the mammary ductal epithelium and penetrating the stroma (M-8500/3).,,,
http://purl.obolibrary.org/obo/MPATH_754,MPATH:754,MPATH:754,splenic hemosiderosis,Spleen contains foci of macrophages containing yellow brown pigment that is positive for iron using Prussian blue.,,,
http://purl.obolibrary.org/obo/MPATH_207,MPATH:207,MPATH:207,immunodeficiency - lymphoid defect,Primary defect in the lymphoid arm of the immune system.,,,
http://purl.obolibrary.org/obo/MPATH_501,MPATH:501,MPATH:501,myelomonocytic leukaemia,Leukaemia in which neoplastic cells are moderately differentiated with a neutrophilic and a monocytic component. At least 20% of the cells have to be blasts.,,,
http://purl.obolibrary.org/obo/MPATH_82,MPATH:82,MPATH:82,persistent embryonic structure,Persistence of an embryonic structure or tissue into the post-natal period in its normal location; (Chronological/temporal anomaly).,,,
http://purl.obolibrary.org/obo/MPATH_295,MPATH:295,MPATH:295,papillary adenocarcinoma,"A malignant neoplasm derived from a glandular epithelium, in which solid tumors show papillary structures projecting onto fibrovascular stroma. (M-8260/3).",,,
http://purl.obolibrary.org/obo/MPATH_767,MPATH:767,MPATH:767,Meckel's diverticulum,A Meckel's diverticulum is a pouch on the wall of the lower part of the intestine that is present at birth.,,,
http://purl.obolibrary.org/obo/MPATH_95,MPATH:95,MPATH:95,hypertrophic ventricle,Thickening of the wall of one or both of the heart ventricles.,,,
http://purl.obolibrary.org/obo/MPATH_527,MPATH:527,MPATH:527,primary mediastinal (thymic) diffuse large B cell lymphoma,Primary B-cell lymphoma of the thymus. Reported in C57BL/6 mice infected with replication defective MuLV. Not clear that this is the equivalent of the human disease.,,,
http://purl.obolibrary.org/obo/MPATH_821,MPATH:821,MPATH:821,hypoplastic tissue,Tissue showing smaller mass as a consequence of deficient proliferation or premature differentiation.,,,
http://purl.obolibrary.org/obo/MPATH_362,MPATH:362,MPATH:362,mesonephroma,"Benign or malignant neoplasm of the ovary and corpus uteri, thought to originate in mesonephric structures. (M-9110/3).",,,
http://purl.obolibrary.org/obo/MPATH_834,MPATH:834,MPATH:834,ovarian tubulostromal tumor,non-malignant neoplasia of the ovary.,,,
http://purl.obolibrary.org/obo/MPATH_375,MPATH:375,MPATH:375,ganglioneuroma,A benign neoplasm composed of mature ganglionic neurons scattered singly or in clumps within a relatively abundant and dense stroma of neurofibrils and collagenous fibers. (M-9490/0).,,,
http://purl.obolibrary.org/obo/MPATH_122,MPATH:122,MPATH:122,petechia,Small hemorrhagic spots in the skin caused by blood vessel breakdown.,,,
http://purl.obolibrary.org/obo/MPATH_847,MPATH:847,MPATH:847,granuloma,Collection of epithelioid macrophages into a nodule,,,
http://purl.obolibrary.org/obo/MPATH_388,MPATH:388,MPATH:388,osseous and chondromatous tumor,Neoplasms of bone and cartilage.,,,
http://purl.obolibrary.org/obo/MPATH_682,MPATH:682,MPATH:682,arteritis,,,,
http://purl.obolibrary.org/obo/MPATH_135,MPATH:135,MPATH:135,epithelial and stromal hyperplasia,Abnormal proliferation of epithelial and stromal cells.,,,
http://purl.obolibrary.org/obo/MPATH_607,MPATH:607,MPATH:607,healing and repair structure,Physical entity or structure associated with normal or abnormal tissue healing or repair following extrinsic or intrinsic damage.,,,
http://purl.obolibrary.org/obo/MPATH_695,MPATH:695,MPATH:695,spindle cell sarcoma,,,,
http://purl.obolibrary.org/obo/MPATH_148,MPATH:148,MPATH:148,mesothelial hyperplasia,Benign proliferation of mesothelial cells lining body cavities presenting as small solid cell clusters or multiple layers with columnar morphology and delicate eosinophilic cytoplasm.,,,
http://purl.obolibrary.org/obo/MPATH_442,MPATH:442,MPATH:442,squamous cell tumor,Neoplasms of stratified squamous epithelial cells.,,,
http://purl.obolibrary.org/obo/MPATH_3,MPATH:3,MPATH:3,apoptosis,"Energy dependent cell death induced by intrinsic genetic or developmental programme, or external stimuli such as addition or withdrawal of cytokines or trophic factors, radiation, chemotherapeutic agents etc. Characterised by cell shrinkage, increases in membrane permeability, endonucleolyis and nuclear fragmentation resulting in the formation of rapidly endocytosed apoptotic bodies.",,,
http://purl.obolibrary.org/obo/MPATH_455,MPATH:455,MPATH:455,choriocarcinoma,"Tumor derived from malignant trophoblastic cells. May be found in the uterus, ovary and testis. May also be derived from teratomas and teratocarcinomas in males. (M-9100/3).",,,
http://purl.obolibrary.org/obo/MPATH_202,MPATH:202,MPATH:202,immunodeficiency disease,Defective immune response; can be primary due to defect in immune system or secondary/acquired due to disease.,,,
http://purl.obolibrary.org/obo/MPATH_290,MPATH:290,MPATH:290,lobular carcinoma in situ,Non-infiltrating form of lobular adenocarcinoma derived from the ductal epithelium. (M-8520/2).,,,
http://purl.obolibrary.org/obo/MPATH_248,MPATH:248,MPATH:248,ependymoma malignant,ependymoma malignant,true,,
http://purl.obolibrary.org/obo/MPATH_468,MPATH:468,MPATH:468,pseudocyst,Formation of extracellular (sensu pancreas) non-epithelial bounded spaces containing accumulated products or substances.,,,
http://purl.obolibrary.org/obo/MPATH_762,MPATH:762,MPATH:762,thyroid follicle pleomorphism,Thyroid gland follicles are filled with colloid but vary greatly in size.,,,
http://purl.obolibrary.org/obo/MPATH_215,MPATH:215,MPATH:215,granulomatous inflammation,"Nodular inflammatory reaction, containing compactly grouped epithelioid cells, giant cells, and other macrophages. The basic inflammatory unit is termed a granuloma.",,,
http://purl.obolibrary.org/obo/MPATH_90,MPATH:90,MPATH:90,aneurysm,Localised dilation of an artery or heart chamber usually due to an acquired or congenital weakness of the wall of the artery or chamber.,,,
http://purl.obolibrary.org/obo/MPATH_775,MPATH:775,MPATH:775,compression,Exertion of abnormal force on a structure or structures usually resulting in deformation and damage.,,,
http://purl.obolibrary.org/obo/MPATH_228,MPATH:228,MPATH:228,papillary hidradenoma,Benign apocrine sweat gland tumor (8405/0).,,,
http://purl.obolibrary.org/obo/MPATH_15,MPATH:15,MPATH:15,general degenerative process,"Change of tissue to a lower state of integrity or less functional form, as in heart failure.",,,
http://purl.obolibrary.org/obo/MPATH_522,MPATH:522,MPATH:522,follicular B cell lymphoma,"A lymphoid proliferation composed of a mixture of centroblasts and centrocytes that may or may not have a nodular(follicular)pattern. The follicular dendritic cell network is not present, unlike in the human. The equivalent typical translocation (Chr. 14:18 )seen in humans has not been reported in the mouse.",,,
http://purl.obolibrary.org/obo/MPATH_788,MPATH:788,MPATH:788,testicular torsion,The testicle twisted around the vascular tract to constrict flow resulting in liquifactive necrosis of the affected testicle.,,,
http://purl.obolibrary.org/obo/MPATH_28,MPATH:28,MPATH:28,atherosclerosis,"Characterised by irregular lipid deposits in the wall of arteries, causing narrowing of their lumens and proceeding eventually to fibrosis and calcification.",,,
http://purl.obolibrary.org/obo/MPATH_535,MPATH:535,MPATH:535,T-cell neoplasms,Neoplasms derived from cells of the T lymphocyte lineage.,,,
http://purl.obolibrary.org/obo/MPATH_370,MPATH:370,MPATH:370,primitive neurectodermal tumor,"Primitive neuroectodermal tumors (PNET) are neoplasms derived from primitive neural stem cells either in the CNS or the periphery . These are small-cell, malignant embryonal tumors showing divergent differentiation of variable degree along neuronal, glial, or rarely mesenchymal lines. (M-9473/3, M-9364/3).",,,
http://purl.obolibrary.org/obo/MPATH_548,MPATH:548,MPATH:548,papillary transitional cell carcinoma,A generally malignant neoplasm consisting of villous or arborescent outgrowths of fibrovascular stroma covered by atypical neoplastic epithelial or urothelial cells cells.,,,
http://purl.obolibrary.org/obo/MPATH_842,MPATH:842,MPATH:842,coccygeal hemivertebrae,abnormally shaped vertebral body often triangular as opposed to rectangular.,,,
http://purl.obolibrary.org/obo/MPATH_383,MPATH:383,MPATH:383,cementoblastoma,A neoplasm arising from the periodontal ligament (M-9273/0).,,,
http://purl.obolibrary.org/obo/MPATH_130,MPATH:130,MPATH:130,mild intra-epithelial neoplasia,Mild non-invasive changes in cell morphology and tissue architecture confined to the epithelium alone.,,,
http://purl.obolibrary.org/obo/MPATH_855,MPATH:855,MPATH:855,Splendore-Hoeppli phenomenon,"In vivo formation of intensely eosinophilic material (radiate, star-like, asteroid or club-shaped configurations) around microorganisms (fungi, bacteria and parasites) or biologically inert substances.",,,
http://purl.obolibrary.org/obo/MPATH_308,MPATH:308,MPATH:308,thyroid C-cell carcinoma,"Malignant neoplasm derived from the calcitonin producing C-cells of the thyroid gland. (M-8510/3, M-8345/3).",,,
http://purl.obolibrary.org/obo/MPATH_602,MPATH:602,MPATH:602,hyperplastic tissue,An organ or a tissue with an abnormal increase in the number of cells as a consequence of cell proliferation.,,,
http://purl.obolibrary.org/obo/MPATH_396,MPATH:396,MPATH:396,osteoma,Benign neoplasm derived from osteoblasts or osteocytes composed of very dense bone with predominantly woven structure. ( M-9180/0).,,,
http://purl.obolibrary.org/obo/MPATH_690,MPATH:690,MPATH:690,phlebitis,,,,
http://purl.obolibrary.org/obo/MPATH_143,MPATH:143,MPATH:143,microglandular hyperplasia,"Benign proliferation of glandular epithelia, eg. Endocervical glands. Consists of tightly packed glandular or tubular units, which vary in size, lined by a flattened-to-cuboidal epithelium.",,,
http://purl.obolibrary.org/obo/MPATH_868,MPATH:868,MPATH:868,uterine ectasia,Dilation of the uterus,,,
http://purl.obolibrary.org/obo/MPATH_615,MPATH:615,MPATH:615,cardiomyopathy,A disease of the heart muscle or myocardium proper.,,,
http://purl.obolibrary.org/obo/MPATH_156,MPATH:156,MPATH:156,parakeratosis,Thickening of the surface cell layer of a stratified squamous epithelium with retention of nuclei in the cells of the stratum corneum.,,,
http://purl.obolibrary.org/obo/MPATH_450,MPATH:450,MPATH:450,transitional cell tumor,"Neoplasms of transitional epithelia, eg kidney, ureter , bladder , cervix.",,,
http://purl.obolibrary.org/obo/MPATH_628,MPATH:628,MPATH:628,pyogenic granuloma,"A small rounded mass of inflamed, highly vascular granulation tissue on the skin, frequently having an ulcerated surface. More likely a true neoplasm rather than a reactive lesion.",,,
http://purl.obolibrary.org/obo/MPATH_169,MPATH:169,MPATH:169,nephrogenic metaplasia,".A rare benign neoplasm of the mucosa of the urinary bladder or the urethra, consisting of tubular structures resembling those of the nephron.",,,
http://purl.obolibrary.org/obo/MPATH_463,MPATH:463,MPATH:463,cataract; cortical liquefactive,Of developmental origins; nucleus and cortex become completely liquefied in post-natal life.,,,
http://purl.obolibrary.org/obo/MPATH_210,MPATH:210,MPATH:210,acquired immunodeficiency,"Defect in the immune system subsequent to external injury, infection or ablation.",,,
http://purl.obolibrary.org/obo/MPATH_476,MPATH:476,MPATH:476,telangiectasia,A lesion formed by a dilated capillary or terminal artery.,,,
http://purl.obolibrary.org/obo/MPATH_770,MPATH:770,MPATH:770,abnormal organ size,Abnormal organ dimensions or weight,,,
http://purl.obolibrary.org/obo/MPATH_223,MPATH:223,MPATH:223,ceruminous adenoma,Benign adenomatous neoplasia of the ceruminous glands of the external auditory meatus (M-8420/0).,,,
http://purl.obolibrary.org/obo/MPATH_10,MPATH:10,MPATH:10,gangrene,"Extensive necrosis from whatever cause, often following chronic ischemia.",,,
http://purl.obolibrary.org/obo/MPATH_783,MPATH:783,MPATH:783,B6 dermatitis,"Follicular dystrophy, rupture, foreign body reaction, ulceration, scarring, pseudoepitheliomatous hyperplasia are part of a syndrome commonly called B6 dermatitis in black strains of mice.",,,
http://purl.obolibrary.org/obo/MPATH_236,MPATH:236,MPATH:236,angiofibroma,.A benign neoplasm of fibrous tissue in which there are multiple large and small dilated vascular channels ( M9160/0).,,,
http://purl.obolibrary.org/obo/MPATH_23,MPATH:23,MPATH:23,peroxysomal defect,Defect in the structure or function of the peroxysomes.,,,
http://purl.obolibrary.org/obo/MPATH_530,MPATH:530,MPATH:530,Plasma cell neoplasms,Diffuse proliferation of mature plasma cells. Clonal by definition. Includes the equivalent of human myeloma (ICD-O 9732/3).,,,
http://purl.obolibrary.org/obo/MPATH_708,MPATH:708,MPATH:708,pyelectasia,Distension of the renal pelvis by accumulated fluid or urine.,,,
http://purl.obolibrary.org/obo/MPATH_796,MPATH:796,MPATH:796,aspermia,Lack of sperm.,,,
http://purl.obolibrary.org/obo/MPATH_249,MPATH:249,MPATH:249,glioma,"Neoplasm derived from astrocytes and oligodendrocytes. (M-9380/3, M-9440/3).",,,
http://purl.obolibrary.org/obo/MPATH_36,MPATH:36,MPATH:36,calcium deposition,Intra or extracellular deposition of calcium usually as calcium phosphate.,,,
http://purl.obolibrary.org/obo/MPATH_543,MPATH:543,MPATH:543,cholangioma,Benign neoplasm of the biliary duct. Occurs in solid and cystic forms. (M-8160/0).,,,
http://purl.obolibrary.org/obo/MPATH_49,MPATH:49,MPATH:49,demyelination,Reduction of myelin content in neuronal sheath.,,,
http://purl.obolibrary.org/obo/MPATH_556,MPATH:556,MPATH:556,potentially cancerous lesions,Lesions which in some cases have the potential to become progressively growing malignant tumors.,,,
http://purl.obolibrary.org/obo/MPATH_850,MPATH:850,MPATH:850,post-traumatic structural abnormality,Morphological abnormality following trauma or related insult such as infection.,,,
http://purl.obolibrary.org/obo/MPATH_303,MPATH:303,MPATH:303,pseudomyxoma peritonei,Tumor characterized by extensive spread of a mucin-secreting neoplasm along the peritoneal surfaces (M-8480/6).,,,
http://purl.obolibrary.org/obo/MPATH_391,MPATH:391,MPATH:391,chondroma,A benign neoplasm derived from mesodermal cells that form cartilage composed of well differentiated hyaline cartilage (M-9220/0).,,,
http://purl.obolibrary.org/obo/MPATH_863,MPATH:863,MPATH:863,focal ulcerative dermatitis,circumscribed ulceration of the skin penetrating the basement membrane as part of  inflammation process.,,,
http://purl.obolibrary.org/obo/MPATH_316,MPATH:316,MPATH:316,mixed germ cell tumor,Malignant neoplasm of the testis/ovary including various elements of germ cell tumors (M-9085/3).,,,
http://purl.obolibrary.org/obo/MPATH_610,MPATH:610,MPATH:610,angiectasia,Dilatation of a blood vessel or valve.,,,
http://purl.obolibrary.org/obo/MPATH_151,MPATH:151,MPATH:151,actinic keratosis,"Discrete, flat or elevated, verrucous, keratotic lesions. Epidermal changes are characterized by acanthosis, parakeratosis, and dyskeratoses. Dysplastic change is present and the keratinocytes vary in size and shape. Associated with UV exposure in humans. Not defined in mice to date.",,,
http://purl.obolibrary.org/obo/MPATH_329,MPATH:329,MPATH:329,luteal cell tumor,Tumor derived from sex cords composed of highly luteinised cells with extensive pale granular cytoplasm. (M- 8610/0).,,,
http://purl.obolibrary.org/obo/MPATH_623,MPATH:623,MPATH:623,synechia,"An adhesion, usually between the iris and the cornea or the lens capsule.",,,
http://purl.obolibrary.org/obo/MPATH_164,MPATH:164,MPATH:164,gastric metaplasia,Appearance of heterotopic gastric epithelium.,,,
http://purl.obolibrary.org/obo/MPATH_636,MPATH:636,MPATH:636,steatitis,Inflammation of fatty tissue.,,,
http://purl.obolibrary.org/obo/MPATH_177,MPATH:177,MPATH:177,angiogenesis,Aberrant process of blood vessel formation and the subsequent remodeling process; does not refer to the initial establishment of the vascular network by vasculogenesis.,,,
http://purl.obolibrary.org/obo/MPATH_471,MPATH:471,MPATH:471,anterior/posterior axis defect,Anteroposterior aberration of the normal symmetrical organisation of the body pattern.,,,
http://purl.obolibrary.org/obo/MPATH_649,MPATH:649,MPATH:649,otitis media,,,,
http://purl.obolibrary.org/obo/MPATH_484,MPATH:484,MPATH:484,hyperplastic nodule,"Expansion of small hyperplastic lesions to become macroscopically nodules, compressing adjacent cells.",,,
http://purl.obolibrary.org/obo/MPATH_231,MPATH:231,MPATH:231,syringoma,"A benign, often multiple, sometimes eruptive neoplasm of the sweat gland ducts composed of very small round cysts. (M-8407/0).",,,
http://purl.obolibrary.org/obo/MPATH_409,MPATH:409,MPATH:409,fibrous histiocytoma,Benign or maligant tumor derived from pluripotential mesenchymal stem cells showing fibrous and histiocytic differentiation (M-8830/0).,,,
http://purl.obolibrary.org/obo/MPATH_65,MPATH:65,MPATH:65,developmental hypoplasia,Underdevelopment of an organ due to a decrease in the number of cells through failure to proliferate leading to lack of development.,true,,
