term,curie,acc,name,description,is_obsolete,replacement,replacement_acc
http://purl.obolibrary.org/obo/PATO_0000639,PATO:0000639,PATO:0000639,degenerate,A structural quality inhering in a bearer whose structure deteriorates or is lost over time due to an active pathological process.,,,
http://purl.obolibrary.org/obo/PATO_0000449,PATO:0000449,PATO:0000449,obsolete increased percentage,,true,,
http://purl.obolibrary.org/obo/PATO_0000259,PATO:0000259,PATO:0000259,obsolete visual_ability,,true,,
http://purl.obolibrary.org/obo/PATO_0001403,PATO:0001403,PATO:0001403,pluripotent,A cellular potency that is the capacity to produce differentiated cell types of all three primary germ layers but not extraembryonic cell types.,,,
http://purl.obolibrary.org/obo/PATO_0002307,PATO:0002307,PATO:0002307,isosceles triangular,A triangular quality inhering in a bearer by virtue of the bearer's having two sides have the same length.,,,
http://purl.obolibrary.org/obo/PATO_0000069,PATO:0000069,PATO:0000069,deviation(from_normal),A quality inhering in a bearer by virtue of the whether the bearer differs from normal or average.,,,
http://purl.obolibrary.org/obo/PATO_0001213,PATO:0001213,PATO:0001213,obsolete mass_unit,,true,,
http://purl.obolibrary.org/obo/PATO_0002117,PATO:0002117,PATO:0002117,glandular,A morphology quality inhering in a bearer by virtue of the bearer's exhbiting the morphological characteristics of a gland.,,,
http://purl.obolibrary.org/obo/PATO_0001023,PATO:0001023,PATO:0001023,momentum,A physical quality inhering in a bearer by virtue of the bearer's velocity multiplied by its mass.,,,
http://purl.obolibrary.org/obo/PATO_0001955,PATO:0001955,PATO:0001955,cuneate,"A shape quality inhering in a bearer by virtue of the bearer's being narrowly triangular, wider at the apex and tapering toward the base.",,,
http://purl.obolibrary.org/obo/PATO_0000861,PATO:0000861,PATO:0000861,obsolete proboscis extension reflex value,,true,,
http://purl.obolibrary.org/obo/PATO_0001765,PATO:0001765,PATO:0001765,decreased age,An age which is low relative to the normal or average.,,,
http://purl.obolibrary.org/obo/PATO_0000671,PATO:0000671,PATO:0000671,obsolete water value,,true,,
http://purl.obolibrary.org/obo/PATO_0001575,PATO:0001575,PATO:0001575,decreased pressure,A pressure which is relatively low.,,,
http://purl.obolibrary.org/obo/PATO_0002479,PATO:0002479,PATO:0002479,obliquely striated,"A shape quality inhering in a bearer by virtue of the bearer's being marked by narrow lines or grooves, usually parallel, that are oriented obliquely relative to the long axis of the bearer.",,,
http://purl.obolibrary.org/obo/PATO_0000481,PATO:0000481,PATO:0000481,obsolete negative regulation,,true,,
http://purl.obolibrary.org/obo/PATO_0001385,PATO:0001385,PATO:0001385,aneuploid,"A ploidy quality inhering in a bearer by virtue of the bearer's containing a non-integral multiple of the monoploid number, due to extra or missing chromosomes.",,,
http://purl.obolibrary.org/obo/PATO_0002289,PATO:0002289,PATO:0002289,setose,A hairy quality inhering in a bearer by virtue of the bearer's being covered with setae.,,,
http://purl.obolibrary.org/obo/PATO_0000291,PATO:0000291,PATO:0000291,obsolete relative respiratory rate,,true,,
http://purl.obolibrary.org/obo/PATO_0001195,PATO:0001195,PATO:0001195,proximal to,A spatial quality inhering in a bearer by virtue of the bearer's being located more centrally than another entity.,,,
http://purl.obolibrary.org/obo/PATO_0002099,PATO:0002099,PATO:0002099,differentiated,A cellular quality inhering in a bearer by virtue of its stable specialization to a particular cell type.,,,
http://purl.obolibrary.org/obo/PATO_0045087,PATO:0045087,PATO:0045087,normal frequency,A frequency which is relatively normal.,,,
http://purl.obolibrary.org/obo/PATO_0005000,PATO:0005000,PATO:0005000,hemispheroid,A 3-D shape that is half of a sphere.,,,
http://purl.obolibrary.org/obo/PATO_0001918,PATO:0001918,PATO:0001918,posteroventral to,A spatial quality inhering in a bearer by virtue of the bearer's being located toward the rear and abdomen of an organism relative to another entity.,,,
http://purl.obolibrary.org/obo/PATO_0000824,PATO:0000824,PATO:0000824,obsolete water taste,,true,,
http://purl.obolibrary.org/obo/PATO_0001728,PATO:0001728,PATO:0001728,multi-cellular organismal disposition,A disposition inhering in a multi-cellular organism.,,,
http://purl.obolibrary.org/obo/PATO_0000634,PATO:0000634,PATO:0000634,unilateral,A spatial pattern inhering in a bearer by virtue of the bearer's involvement of only one part or side.,,,
http://purl.obolibrary.org/obo/PATO_0001538,PATO:0001538,PATO:0001538,insoluble in,A solubility quality inhering in a substance by virtue of the bearer's inability of a substance to dissolve in a liquid.,,,
http://purl.obolibrary.org/obo/PATO_0000444,PATO:0000444,PATO:0000444,obsolete percentage value,,true,,
http://purl.obolibrary.org/obo/PATO_0001348,PATO:0001348,PATO:0001348,F minus mating type,A bacterial mating type indicating the absence of F plasmid in a bacterial cell.,,,
http://purl.obolibrary.org/obo/PATO_0000254,PATO:0000254,PATO:0000254,obsolete vibrissae reflex,,true,,
http://purl.obolibrary.org/obo/PATO_0001158,PATO:0001158,PATO:0001158,obsolete relative concentration value,,true,,
http://purl.obolibrary.org/obo/PATO_0002302,PATO:0002302,PATO:0002302,decreased process quality,A quality of a process that has a value that is decreased compared to normal or average.,,,
http://purl.obolibrary.org/obo/PATO_0000064,PATO:0000064,PATO:0000064,obsolete absolute percentage,,true,,
http://purl.obolibrary.org/obo/PATO_0000982,PATO:0000982,PATO:0000982,permeable,A permeability quality inhering in a bearer by virtue of the bearer's being capable to be permeated or pervaded by a gas or liquid (as by osmosis or diffusion).,,,
http://purl.obolibrary.org/obo/PATO_0002112,PATO:0002112,PATO:0002112,perforate,"A structural quality inhering in a bearer by virtue of the bearer's having a hole or holes, especially a row or array of small holes.",,,
http://purl.obolibrary.org/obo/PATO_0000996,PATO:0000996,PATO:0000996,obsolete absolute viscosity value,,true,,
http://purl.obolibrary.org/obo/PATO_0001950,PATO:0001950,PATO:0001950,blunt,A shape quality inhering in a bearer by virtue of the bearer's terminating gradually in a rounded end.,,,
http://purl.obolibrary.org/obo/PATO_0001760,PATO:0001760,PATO:0001760,female semi-fertile,,,,
http://purl.obolibrary.org/obo/PATO_0001570,PATO:0001570,PATO:0001570,having decreased processual parts,A quality of a process inhering in a bearer by virtue of the bearer's having fewer processual parts.,,,
http://purl.obolibrary.org/obo/PATO_0002474,PATO:0002474,PATO:0002474,bitter,"A flavor quality inhering in a bearer by virtue of the bearer's having an acrid, sharp, or disagreeable flavor.",,,
http://purl.obolibrary.org/obo/PATO_0001380,PATO:0001380,PATO:0001380,paleopolyploid,A polyploidy quality inhering in a bearer by virtue of the bearer's having an ancient polyploid ancestor.,,,
http://purl.obolibrary.org/obo/PATO_0002284,PATO:0002284,PATO:0002284,tension,A physical quality that pertains by virtue of a pulling force that is directed away from the bearer and attempts to stretch or elongate the bearer.,,,
http://purl.obolibrary.org/obo/PATO_0001190,PATO:0001190,PATO:0001190,juvenile,A maturity quality inhering in a bearer by virtue the bearer's being not fully grown or developed.,,,
http://purl.obolibrary.org/obo/PATO_0002094,PATO:0002094,PATO:0002094,basophilic,An affinity inhering in a tissue constituent by virtue of the bearer exhibiting a molecular interaction for basic dyes under specific ph conditions.,,,
http://purl.obolibrary.org/obo/PATO_0000407,PATO:0000407,PATO:0000407,flat,"A quality inhering in a bearer by virtue of the bearer's having a horizontal surface without a slope, tilt, or curvature.",,,
http://purl.obolibrary.org/obo/PATO_0045082,PATO:0045082,PATO:0045082,normal waxiness,A waxiness which is relatively normal or average,,,
http://purl.obolibrary.org/obo/PATO_0000217,PATO:0000217,PATO:0000217,obsolete immune function,,true,,
http://purl.obolibrary.org/obo/PATO_0000027,PATO:0000027,PATO:0000027,obsolete electrolyte composition,,true,,
http://purl.obolibrary.org/obo/PATO_0000959,PATO:0000959,PATO:0000959,obsolete relative opacity,,true,,
http://purl.obolibrary.org/obo/PATO_0000769,PATO:0000769,PATO:0000769,coordinated,A coordination quality of inhering in a bearer by virtue of the bearer's having skillful and effective interaction of movement.,,,
http://purl.obolibrary.org/obo/PATO_0001913,PATO:0001913,PATO:0001913,ictal,A physiological state which is characterized by periods of high-frequency high amplitude electrical activity in neuronal tissue.,,,
http://purl.obolibrary.org/obo/PATO_0001723,PATO:0001723,PATO:0001723,increased female receptivity,A female receptivity which is relatively high.,,,
http://purl.obolibrary.org/obo/PATO_0000389,PATO:0000389,PATO:0000389,acute,"A quality of a process inhering in a bearer by virtue of the bearer's having a sudden onset, sharp rise, and short course.",,,
http://purl.obolibrary.org/obo/PATO_0001533,PATO:0001533,PATO:0001533,multi-colored,A color pattern inhering in a bearer by virtue of bearer's having two or more hues or degrees of saturation.,,,
http://purl.obolibrary.org/obo/PATO_0002437,PATO:0002437,PATO:0002437,interlocked with,A structural quality inhering in a bearer by virtue of the bearer's being locked together or interconnected to another entity.,,,
http://purl.obolibrary.org/obo/PATO_0000199,PATO:0000199,PATO:0000199,obsolete relative consumption,,true,,
http://purl.obolibrary.org/obo/PATO_0001343,PATO:0001343,PATO:0001343,Schizosaccharomyces pombe mating type,A S. pombe mating type determined by the gene configuration on the mat1 locus.,,,
http://purl.obolibrary.org/obo/PATO_0002247,PATO:0002247,PATO:0002247,degree of pigmentation,A quality inhering in a bearer by virtue of the bearer's having or lacking of substances produced by living organisms that have a color resulting from selective color absorption.,,,
http://purl.obolibrary.org/obo/PATO_0001153,PATO:0001153,PATO:0001153,insusceptible toward,A quality inhering in a bearer by virtue of the bearer's lacking susceptibilty toward an external stimulus.,,,
http://purl.obolibrary.org/obo/PATO_0020001,PATO:0020001,PATO:0020001,male genotypic sex,A biological sex quality inhering in an individual based upon genotypic composition that confers the capability for an organism to differentiate male gonads.,,,
http://purl.obolibrary.org/obo/PATO_0002057,PATO:0002057,PATO:0002057,increased area,An area which is relatively high.,,,
http://purl.obolibrary.org/obo/PATO_0045045,PATO:0045045,PATO:0045045,normal radioactivity,A radioactivity which is relatively normal or average,,,
http://purl.obolibrary.org/obo/PATO_0040026,PATO:0040026,PATO:0040026,structurally discontinuous,A structural quality inhering in a bearer by virtue of the bearer's being marked by interruptions or gaps.,,,
http://purl.obolibrary.org/obo/PATO_0000991,PATO:0000991,PATO:0000991,obsolete inconsistent,,true,,
http://purl.obolibrary.org/obo/PATO_0001895,PATO:0001895,PATO:0001895,mating type,A biological sex quality inhering in an individual or a population that undergo sexual reproduction.,,,
http://purl.obolibrary.org/obo/PATO_0000402,PATO:0000402,PATO:0000402,branched,A branchiness quality inhering in a bearer by virtue of the bearer's having branches.,,,
http://purl.obolibrary.org/obo/PATO_0001306,PATO:0001306,PATO:0001306,decreased temperature,A temperature which is relatively low.,,,
http://purl.obolibrary.org/obo/PATO_0000212,PATO:0000212,PATO:0000212,obsolete neural function,,true,,
http://purl.obolibrary.org/obo/PATO_0001116,PATO:0001116,PATO:0001116,obsolete relative impulse value,,true,,
http://purl.obolibrary.org/obo/PATO_0000022,PATO:0000022,PATO:0000022,obsolete gametophytic compatability,,true,,
http://purl.obolibrary.org/obo/PATO_0045008,PATO:0045008,PATO:0045008,normal cellular motility,A cellular motility which is normal or average.,,,
http://purl.obolibrary.org/obo/PATO_0000954,PATO:0000954,PATO:0000954,pink,Red color having medium to high brightness and low to moderate saturation.,,,
http://purl.obolibrary.org/obo/PATO_0001858,PATO:0001858,PATO:0001858,partially paralysed,A functionality quality inhering in a bearer by virtue of being not completely paralysed.,,,
http://purl.obolibrary.org/obo/PATO_0000764,PATO:0000764,PATO:0000764,passive,A behavioral quality inhering in a bearer by virtue of the bearer's receiving or being subjected to an action without responding or initiating an action in return.,,,
http://purl.obolibrary.org/obo/PATO_0001668,PATO:0001668,PATO:0001668,associated with,A structural quality inhering in a bearer by virtue of the bearer's being in close proximity and physically interacting with another entity.,,,
http://purl.obolibrary.org/obo/PATO_0000574,PATO:0000574,PATO:0000574,decreased length,A length quality which is relatively small.,,,
http://purl.obolibrary.org/obo/PATO_0001478,PATO:0001478,PATO:0001478,collapsed,A structural quality inhering in a bearer by virtue of the bearer's being broken down; caved in.,,,
http://purl.obolibrary.org/obo/PATO_0000384,PATO:0000384,PATO:0000384,male,A biological sex quality inhering in an individual or a population whose sex organs contain only male gametes.,,,
http://purl.obolibrary.org/obo/PATO_0001288,PATO:0001288,PATO:0001288,dark red brown,A color consisting of red and brown hue and low brightness.,,,
http://purl.obolibrary.org/obo/PATO_0002432,PATO:0002432,PATO:0002432,spade-shaped,A shape that is in the form of a spade.,,,
http://purl.obolibrary.org/obo/PATO_0000194,PATO:0000194,PATO:0000194,obsolete spontaneous_activity,,true,,
http://purl.obolibrary.org/obo/PATO_0001098,PATO:0001098,PATO:0001098,obsolete absolute force,,true,,
http://purl.obolibrary.org/obo/PATO_0002052,PATO:0002052,PATO:0002052,decreased occurrence,An occurrence which is relatively low.,,,
http://purl.obolibrary.org/obo/PATO_0045040,PATO:0045040,PATO:0045040,normal position,A position which is relatively normal or average,,,
http://purl.obolibrary.org/obo/PATO_0040021,PATO:0040021,PATO:0040021,unpaired,"The bearer of this quality has_part n=1 of the indicated entity type, where n is bilaterally paired for a comparable organism..",,,
http://purl.obolibrary.org/obo/PATO_0001890,PATO:0001890,PATO:0001890,tripartite,A concave 3-D shape quality inhering in a bearer by virtue of the bearer's being divided into three branches.,,,
http://purl.obolibrary.org/obo/PATO_0000917,PATO:0000917,PATO:0000917,obsolete relative thickness,,true,,
http://purl.obolibrary.org/obo/PATO_0000727,PATO:0000727,PATO:0000727,obsolete behavioral function value,,true,,
http://purl.obolibrary.org/obo/PATO_0000537,PATO:0000537,PATO:0000537,obsolete acid sensitivity value,,true,,
http://purl.obolibrary.org/obo/PATO_0000347,PATO:0000347,PATO:0000347,obsolete sporophyte incompatible value,,true,,
http://purl.obolibrary.org/obo/PATO_0000157,PATO:0000157,PATO:0000157,obsolete absolute temporal,,true,,
http://purl.obolibrary.org/obo/PATO_0001301,PATO:0001301,PATO:0001301,chromatic property,"An optical quality that is the mixture, purity or pattern of wavelengths of light perceived by the observer.",,,
http://purl.obolibrary.org/obo/PATO_0002205,PATO:0002205,PATO:0002205,capacitance,A quality inhering in a bearer by virtue of the bearer's ability to hold an electrical charge.,,,
http://purl.obolibrary.org/obo/PATO_0001111,PATO:0001111,PATO:0001111,obsolete relative density value,,true,,
http://purl.obolibrary.org/obo/PATO_0045003,PATO:0045003,PATO:0045003,normal adhesivity,A adhesivity which is relatively normal or average.,,,
http://purl.obolibrary.org/obo/PATO_0000899,PATO:0000899,PATO:0000899,obsolete soma dependent fertility value,,true,,
http://purl.obolibrary.org/obo/PATO_0001853,PATO:0001853,PATO:0001853,hydrocephalic,A structural quality which is held by a bearer when the latter exhibits an excessive accumulation of cerebral spinal fluid.,,,
http://purl.obolibrary.org/obo/PATO_0001663,PATO:0001663,PATO:0001663,increased solubility,A solubility which is relatively high.,,,
http://purl.obolibrary.org/obo/PATO_0001473,PATO:0001473,PATO:0001473,duplicated,A quality inhering in a bearer by virtue of the bearer's being present in two copies.,,,
http://purl.obolibrary.org/obo/PATO_0002377,PATO:0002377,PATO:0002377,uninflated,A structure quality inhering in a bearer by virtue of the bearer's being not filed with air.,,,
http://purl.obolibrary.org/obo/PATO_0001283,PATO:0001283,PATO:0001283,saturated red,A color consisting of red hue and high saturation.,,,
http://purl.obolibrary.org/obo/PATO_0002187,PATO:0002187,PATO:0002187,polar polarity,"Polar polarity is a quality that inheres in a molecular entity when the molecular entity is polar, i.e. does possess an electric dipole.",,,
http://purl.obolibrary.org/obo/PATO_0001093,PATO:0001093,PATO:0001093,obsolete relative flux value,,true,,
http://purl.obolibrary.org/obo/PATO_0000912,PATO:0000912,PATO:0000912,increased rate,A rate which is relatively high.,,,
http://purl.obolibrary.org/obo/PATO_0001816,PATO:0001816,PATO:0001816,increased fatigability,A fatigability which is relatively high.,,,
http://purl.obolibrary.org/obo/PATO_0000722,PATO:0000722,PATO:0000722,obsolete relative yield value,,true,,
http://purl.obolibrary.org/obo/PATO_0001626,PATO:0001626,PATO:0001626,sufficiency,A structural quality inhering in a bearer by virtue of whether the bearer has enough functionality.,,,
http://purl.obolibrary.org/obo/PATO_0000532,PATO:0000532,PATO:0000532,obsolete micronutrient sensitivity value,,true,,
http://purl.obolibrary.org/obo/PATO_0001436,PATO:0001436,PATO:0001436,sessile (sensu botany),"An attachment quality inhering in a flower by virtue of the bearer's lacking a stalk, as in flowers or leaves that grow directly from the stem.",,,
http://purl.obolibrary.org/obo/PATO_0000342,PATO:0000342,PATO:0000342,obsolete gametophyte compatible value,,true,,
http://purl.obolibrary.org/obo/PATO_0001246,PATO:0001246,PATO:0001246,light brown,A color consisting of brown hue and high brightness.,,,
http://purl.obolibrary.org/obo/PATO_0000152,PATO:0000152,PATO:0000152,threshold,A quality inhering in a bearer by virtue of the bearer's sensitivity towards a fixed location or value where a change is observed; upper limit.,,,
http://purl.obolibrary.org/obo/PATO_0001056,PATO:0001056,PATO:0001056,obsolete number,,true,,
http://purl.obolibrary.org/obo/PATO_0002200,PATO:0002200,PATO:0002200,vaporizability,A quality which inheres in a substance by virtue of the ease with which the substance can be changed into a gaseous state.,,,
http://purl.obolibrary.org/obo/PATO_0002010,PATO:0002010,PATO:0002010,looseness,A texture quality inhering in a bearer by virtue of the bearer's bing full of small openings or gaps.,,,
http://purl.obolibrary.org/obo/PATO_0001988,PATO:0001988,PATO:0001988,quadrangular,A shape quality inhering in a bearer by virtue of the bearer's having four angles and four sides.,,,
http://purl.obolibrary.org/obo/PATO_0000894,PATO:0000894,PATO:0000894,obsolete cytoplasmic sterility value,,true,,
http://purl.obolibrary.org/obo/PATO_0001798,PATO:0001798,PATO:0001798,kinked,A shape quality inhering in a bearer by virtue of the bearer's having multiple angles in its length.,,,
http://purl.obolibrary.org/obo/PATO_0002372,PATO:0002372,PATO:0002372,grand multiparous,A viviparous organism that has given birth five or more times.,,,
http://purl.obolibrary.org/obo/PATO_0002182,PATO:0002182,PATO:0002182,molecular quality,"A quality which inheres in a molecular entity, a single molecule, atom, ion, radical etc.",,,
http://purl.obolibrary.org/obo/PATO_0000305,PATO:0000305,PATO:0000305,obsolete age value,,true,,
http://purl.obolibrary.org/obo/PATO_0001209,PATO:0001209,PATO:0001209,obsolete absolute function,,true,,
http://purl.obolibrary.org/obo/PATO_0000115,PATO:0000115,PATO:0000115,obsolete absolute temperature sensitivity,,true,,
http://purl.obolibrary.org/obo/PATO_0001019,PATO:0001019,PATO:0001019,mass density,A physical quality which inheres in a bearer by virtue of some influence is exerted by the bearer's mass per unit size.,,,
http://purl.obolibrary.org/obo/PATO_0000857,PATO:0000857,PATO:0000857,obsolete lordosis reflex value,,true,,
http://purl.obolibrary.org/obo/PATO_0000667,PATO:0000667,PATO:0000667,obsolete liquid substance value,,true,,
http://purl.obolibrary.org/obo/PATO_0001811,PATO:0001811,PATO:0001811,obsolete increased relaxation,A relaxation which is relatively high.,true,,
http://purl.obolibrary.org/obo/PATO_0000477,PATO:0000477,PATO:0000477,obsolete good value,,true,,
http://purl.obolibrary.org/obo/PATO_0001621,PATO:0001621,PATO:0001621,decreased turgor,A turgor which is relatively low.,,,
http://purl.obolibrary.org/obo/PATO_0002525,PATO:0002525,PATO:0002525,separating,"A structural quality inhering in a bearer by virtue of the bearer being in a position that produces a separation in, or acting to separate, another entity.",,,
http://purl.obolibrary.org/obo/PATO_0000287,PATO:0000287,PATO:0000287,obsolete absolute litter size,,true,,
http://purl.obolibrary.org/obo/PATO_0001431,PATO:0001431,PATO:0001431,adhesivity,An emergent molecular quality that arises by virtue of the bearer's disposition to exhibit molecular attraction to another entity in contact.,,,
http://purl.obolibrary.org/obo/PATO_0002335,PATO:0002335,PATO:0002335,tholiform,A shape quality inhering in a bearer by virtue of the bearer's being dome-shaped.,,,
http://purl.obolibrary.org/obo/PATO_0000097,PATO:0000097,PATO:0000097,obsolete herbicide sensitivity,,true,,
http://purl.obolibrary.org/obo/PATO_0001241,PATO:0001241,PATO:0001241,physical object quality,A quality which inheres in a continuant.,,,
http://purl.obolibrary.org/obo/PATO_0002145,PATO:0002145,PATO:0002145,decreased radiopacity,A radiopacity that is relatively low.,,,
http://purl.obolibrary.org/obo/PATO_0001051,PATO:0001051,PATO:0001051,acute angle to,An angle which is less than 90 degrees.,,,
http://purl.obolibrary.org/obo/PATO_0001983,PATO:0001983,PATO:0001983,perfoliate,A structural quality inhering in a bearer by virtue of the bearer's two basal lobes being united together.,,,
http://purl.obolibrary.org/obo/PATO_0001793,PATO:0001793,PATO:0001793,right side of,A spatial quality inhering in a bearer by virtue of the bearer's being located on right side of a another entity.,,,
http://purl.obolibrary.org/obo/PATO_0000300,PATO:0000300,PATO:0000300,immobile,A mobility quality inhering in a bearer by virtue of the bearer's being incapable to move freely.,,,
http://purl.obolibrary.org/obo/PATO_0001204,PATO:0001204,PATO:0001204,obsolete not enlarged,,true,,
http://purl.obolibrary.org/obo/PATO_0002108,PATO:0002108,PATO:0002108,papillary,A quality inhering in a bearer by virtue of the bearer's resembling small nipple like projection.,,,
http://purl.obolibrary.org/obo/PATO_0000110,PATO:0000110,PATO:0000110,obsolete drought sensitivity,,true,,
http://purl.obolibrary.org/obo/PATO_0001014,PATO:0001014,PATO:0001014,obsolete absolute occurence,,true,,
http://purl.obolibrary.org/obo/PATO_0001946,PATO:0001946,PATO:0001946,banded,A color pattern inhering in a bearer by virtue of bearer's exhibiting transverse stripes of one hue or degree of saturation crossing another.,,,
http://purl.obolibrary.org/obo/PATO_0000852,PATO:0000852,PATO:0000852,obsolete relative auditory threshold,,true,,
http://purl.obolibrary.org/obo/PATO_0001756,PATO:0001756,PATO:0001756,heat conductivity,A conductivity quality inhering in a bearer by virtue of the bearer's disposition to spontaneous transfer of thermal energy from a region of higher temperature to a region of lower temperature.,,,
http://purl.obolibrary.org/obo/PATO_0000662,PATO:0000662,PATO:0000662,obsolete volume_quantity,,true,,
http://purl.obolibrary.org/obo/PATO_0001566,PATO:0001566,PATO:0001566,distributed,A spatial pattern inhering in a bearer by virtue of the bearer's being spread out or scattered about or divided up.,,,
http://purl.obolibrary.org/obo/PATO_0000472,PATO:0000472,PATO:0000472,obsolete quality value,,true,,
http://purl.obolibrary.org/obo/PATO_0001376,PATO:0001376,PATO:0001376,monoploid,A ploidy quality inhering in a bearer by virtue of the bearer's containing a single set of unique homologous chromosomes.,,,
http://purl.obolibrary.org/obo/PATO_0002520,PATO:0002520,PATO:0002520,scute-like,A shape quality inhering in a bearer by virtue of the bearer being shaped like a scute or an osteoderm.,,,
http://purl.obolibrary.org/obo/PATO_0000282,PATO:0000282,PATO:0000282,obsolete f1 fertility,,true,,
http://purl.obolibrary.org/obo/PATO_0001186,PATO:0001186,PATO:0001186,prepubescent,A maturity quality inhering in a bearer by virtue of the bearer's being at the age immediately before puberty.,,,
http://purl.obolibrary.org/obo/PATO_0002330,PATO:0002330,PATO:0002330,oblanceolate,"A quality inhering in a bearer by virtue of the bearer's being extended along a straight line, and is shaped like a reversed lance-point, with the tapering point attached to the leafstalk.",,,
http://purl.obolibrary.org/obo/PATO_0000092,PATO:0000092,PATO:0000092,obsolete abiotic stress sensitivity,,true,,
http://purl.obolibrary.org/obo/PATO_0002140,PATO:0002140,PATO:0002140,inedible,A physical quality inhering in a bearer by virtue of the bearer not being suitable for use as food.,,,
http://purl.obolibrary.org/obo/PATO_0045078,PATO:0045078,PATO:0045078,normal variability of temperature,A variability of temperature which is relatively normal or average,,,
http://purl.obolibrary.org/obo/PATO_0015029,PATO:0015029,PATO:0015029,quality of a suspension,"A physical quality inhering in an entity by virtue of the bearer's solid or liquid constituents being transiently dispersed in a solid, liquid, or gas before settling due to gravity or centrifugal forces.",,,
