term,curie,acc,name,description,is_obsolete,replacement,replacement_acc
http://purl.obolibrary.org/obo/PATO_0045061,PATO:0045061,PATO:0045061,normal width,A width which is relatively normal or average,,,
http://purl.obolibrary.org/obo/PATO_0000006,PATO:0000006,PATO:0000006,obsolete process,,true,,
http://purl.obolibrary.org/obo/PATO_0015012,PATO:0015012,PATO:0015012,quality of a plasma,"A physical quality inhering in a bearer by virtue of the bearer's exhibiting the physical characteristics of an entity consisting of roughly equal proportions of positively and negatively charged particles, having neither a defined volume nor defined shape, having internal magnetic fields, and being electrically conductive.",,,
http://purl.obolibrary.org/obo/PATO_0000938,PATO:0000938,PATO:0000938,organized,A structural quality inhering in a bearer by virtue of the bearer's exhibiting organisation.,,,
http://purl.obolibrary.org/obo/PATO_0000748,PATO:0000748,PATO:0000748,obsolete discrimination value,,true,,
http://purl.obolibrary.org/obo/PATO_0000558,PATO:0000558,PATO:0000558,obsolete size value,,true,,
http://purl.obolibrary.org/obo/PATO_0001702,PATO:0001702,PATO:0001702,saturated violet,A color consisting of violet hue and high saturation.,,,
http://purl.obolibrary.org/obo/PATO_0000368,PATO:0000368,PATO:0000368,obsolete towards1,,true,,
http://purl.obolibrary.org/obo/PATO_0000333,PATO:0000333,PATO:0000333,spotted,A color pattern inhering in a bearer by virtue of bearer's being marked with a round area of different hue or degree of saturation.,,,
http://purl.obolibrary.org/obo/PATO_0001512,PATO:0001512,PATO:0001512,punctate,"A pattern inhering in a surface by virtue of the bearer's being marked by the presence of dots, punctures, points or pits.",,,
http://purl.obolibrary.org/obo/PATO_0002416,PATO:0002416,PATO:0002416,sunken,Flattened from above downward; below the normal level or the level of the surrounding parts.,,,
http://purl.obolibrary.org/obo/PATO_0000178,PATO:0000178,PATO:0000178,obsolete relative function,,true,,
http://purl.obolibrary.org/obo/PATO_0001322,PATO:0001322,PATO:0001322,straight angle to,An angle which is 180 degrees to another entity.,,,
http://purl.obolibrary.org/obo/PATO_0002226,PATO:0002226,PATO:0002226,subcylindrical,A cylindrical shape quality inhering in a bearer by virtue of the bearer's being imperfectly cylindrical or approximately cylindrical.,,,
http://purl.obolibrary.org/obo/PATO_0001132,PATO:0001132,PATO:0001132,obsolete relative ratio value,,true,,
http://purl.obolibrary.org/obo/PATO_0002036,PATO:0002036,PATO:0002036,axial to,A spatial quality inhering in a bearer by virtue of the bearer's being located towards the central axis of the organism or an extremity.,,,
http://purl.obolibrary.org/obo/PATO_0045024,PATO:0045024,PATO:0045024,normal force,A force which is relatively normal or average.,,,
http://purl.obolibrary.org/obo/PATO_0040005,PATO:0040005,PATO:0040005,posteroventral orientation,An orientation quality inhering in a bearer by virtue of the bearer having a position that is directed posteroventrally.,,,
http://purl.obolibrary.org/obo/PATO_0000970,PATO:0000970,PATO:0000970,permeability,A structural quality inhering in a bearer by virtue of the bearer's disposition to being permeated or pervaded by a gas or liquid (as by osmosis or diffusion).,,,
http://purl.obolibrary.org/obo/PATO_0001874,PATO:0001874,PATO:0001874,discoid,"A shape quality inhering in a bearer by virtue of the bearer's being cylindrical, in which the height is less than the diameter.",,,
http://purl.obolibrary.org/obo/PATO_0000780,PATO:0000780,PATO:0000780,obsolete relative locomotor activity value,,true,,
http://purl.obolibrary.org/obo/PATO_0001684,PATO:0001684,PATO:0001684,decreased magnetism,A magnetism which is relatively low.,,,
http://purl.obolibrary.org/obo/PATO_0000590,PATO:0000590,PATO:0000590,obsolete relative thickness value,,true,,
http://purl.obolibrary.org/obo/PATO_0001494,PATO:0001494,PATO:0001494,hypotrophic growth,,,,
http://purl.obolibrary.org/obo/PATO_0002398,PATO:0002398,PATO:0002398,obsolete <new term>,,true,,
http://purl.obolibrary.org/obo/PATO_0000933,PATO:0000933,PATO:0000933,obsolete red light sensitivity,,true,,
http://purl.obolibrary.org/obo/PATO_0000743,PATO:0000743,PATO:0000743,obsolete arousal value,,true,,
http://purl.obolibrary.org/obo/PATO_0000553,PATO:0000553,PATO:0000553,obsolete relative temperature sensitivity value,,true,,
http://purl.obolibrary.org/obo/PATO_0001457,PATO:0001457,PATO:0001457,sensitivity of a process,A quality of a process inhering in bearer by virtue of the bearer's disposition to respond to stimulation.,,,
http://purl.obolibrary.org/obo/PATO_0000363,PATO:0000363,PATO:0000363,obsolete away,,true,,
http://purl.obolibrary.org/obo/PATO_0001267,PATO:0001267,PATO:0001267,saturated brown,A color consisting of brown hue and high saturation.,,,
http://purl.obolibrary.org/obo/PATO_0002411,PATO:0002411,PATO:0002411,yellow brown,A color consisting of yellow and brown hue.,,,
http://purl.obolibrary.org/obo/PATO_0000173,PATO:0000173,PATO:0000173,obsolete function,,true,,
http://purl.obolibrary.org/obo/PATO_0001077,PATO:0001077,PATO:0001077,obsolete absolute pressure,,true,,
http://purl.obolibrary.org/obo/PATO_0002221,PATO:0002221,PATO:0002221,increased phosphorylation,"A quality inhering in a bearer by virtue of the bearer's being phosphorylated to a more than normal extent, or fully saturated with phosphate groups.",,,
http://purl.obolibrary.org/obo/PATO_0002031,PATO:0002031,PATO:0002031,upturned,A curvature quality inhering in a bearer by virtue of the bearer's being curved or tilted such that the tip points upwards.,,,
http://purl.obolibrary.org/obo/PATO_0040000,PATO:0040000,PATO:0040000,heterotaxic,An oriented quality inhering in a bearer by virtue of the bearer's being abnormally placed or arranged.,,,
http://purl.obolibrary.org/obo/PATO_0002393,PATO:0002393,PATO:0002393,increased tolerance to,A tolerance quality inhering in a bearer by virtue of the bearer's increased ability to endure a stimulus.,,,
http://purl.obolibrary.org/obo/PATO_0000706,PATO:0000706,PATO:0000706,increased threshold,A threshold which is relatively high.,,,
http://purl.obolibrary.org/obo/PATO_0000516,PATO:0000516,PATO:0000516,sensitive toward,A quality inhering in a bearer by virtue of the bearer's having sensitivity toward an external stimulus.,,,
http://purl.obolibrary.org/obo/PATO_0000326,PATO:0000326,PATO:0000326,obsolete dim,,true,,
http://purl.obolibrary.org/obo/PATO_0000136,PATO:0000136,PATO:0000136,closure,"A morphological quality pertaining to the degree to which an object contains an opening, aperture, orifice or vent.",,,
http://purl.obolibrary.org/obo/PATO_0000878,PATO:0000878,PATO:0000878,obsolete relative respiratory rate value,,true,,
http://purl.obolibrary.org/obo/PATO_0000688,PATO:0000688,PATO:0000688,asynchronous,A quality of a single process inhering in a bearer by virtue of the bearer's not occurring or existing at the same time or having the same period or phase.,,,
http://purl.obolibrary.org/obo/PATO_0001832,PATO:0001832,PATO:0001832,increased male fertility,A male fertility which is relatively high.,,,
http://purl.obolibrary.org/obo/PATO_0000498,PATO:0000498,PATO:0000498,increased duration,A duration quality of a process which is relatively high.,,,
http://purl.obolibrary.org/obo/PATO_0001863,PATO:0001863,PATO:0001863,chronic,A duration quality of a process inhering in a bearer by virtue of the bearer's having slow progressive course of indefinite duration.,,,
http://purl.obolibrary.org/obo/PATO_0002356,PATO:0002356,PATO:0002356,constitutively active,A quality of a physical object that has been constantly realizing some of its functions.,,,
http://purl.obolibrary.org/obo/PATO_0001262,PATO:0001262,PATO:0001262,light red,A color consisting of red hue and high brightness.,,,
http://purl.obolibrary.org/obo/PATO_0002166,PATO:0002166,PATO:0002166,premature closure,A duration quality of a process inhering in a bearer by virtue of the bearer's premature completion of the closure of the opening of an anatomical entity.,,,
http://purl.obolibrary.org/obo/PATO_0001072,PATO:0001072,PATO:0001072,obsolete absolute energy,,true,,
http://purl.obolibrary.org/obo/PATO_0005017,PATO:0005017,PATO:0005017,labiolingually compressed,A quality inhering in a bearer by virtue of the bearer's being compressed from the side facing the lips to the side facing the tongue.,,,
http://purl.obolibrary.org/obo/PATO_0000701,PATO:0000701,PATO:0000701,smooth,A texture quality inhering in a bearer by virtue of the bearer's processing a surface free of roughness or irregularities.,,,
http://purl.obolibrary.org/obo/PATO_0002509,PATO:0002509,PATO:0002509,hexagonal,A 2-D shape quality inhering in a bearer by virtue of the bearer's having six angles and six sides.,,,
http://purl.obolibrary.org/obo/PATO_0001605,PATO:0001605,PATO:0001605,disheveled,A spatial pattern inhering in a bearer by virtue of the bearer's being in disarray; extremely disorderly.,,,
http://purl.obolibrary.org/obo/PATO_0000511,PATO:0000511,PATO:0000511,obsolete absolute disease sensitivity value,,true,,
http://purl.obolibrary.org/obo/PATO_0001415,PATO:0001415,PATO:0001415,morbidity,A quality inhering in a population by virtue of the proportion of its members that are ill at a given time.,,,
http://purl.obolibrary.org/obo/PATO_0002319,PATO:0002319,PATO:0002319,squircle,A shape with properties between those of a square and those of a circle.,,,
http://purl.obolibrary.org/obo/PATO_0000321,PATO:0000321,PATO:0000321,magenta,A color consisting of red and blue hues.,,,
http://purl.obolibrary.org/obo/PATO_0001225,PATO:0001225,PATO:0001225,obsolete relational number,,true,,
http://purl.obolibrary.org/obo/PATO_0002129,PATO:0002129,PATO:0002129,"neoplastic, invasive",A disposition inhering in a tumour by virtue of the bearer's disposition to invade surrounding tissues.,,,
http://purl.obolibrary.org/obo/PATO_0000131,PATO:0000131,PATO:0000131,obsolete relative size,,true,,
http://purl.obolibrary.org/obo/PATO_0001035,PATO:0001035,PATO:0001035,force,A physical quality inhering in a bearer by virtue of the bearer's rate of change of momentum.,,,
http://purl.obolibrary.org/obo/PATO_0001967,PATO:0001967,PATO:0001967,actinodromous,A branched quality inhering in a bearer by virtue of the bearer's having three or more primary branches diverging radially from a single point.,,,
http://purl.obolibrary.org/obo/PATO_0000873,PATO:0000873,PATO:0000873,obsolete cataleptic,,true,,
http://purl.obolibrary.org/obo/PATO_0001777,PATO:0001777,PATO:0001777,decreased flexibility,A flexibility which is relatively low.,,,
http://purl.obolibrary.org/obo/PATO_0000683,PATO:0000683,PATO:0000683,obsolete relative temporal value,,true,,
http://purl.obolibrary.org/obo/PATO_0001587,PATO:0001587,PATO:0001587,increased variability of rate,A variability of rate which is relatively high.,,,
http://purl.obolibrary.org/obo/PATO_0000493,PATO:0000493,PATO:0000493,obsolete amplitude value,,true,,
http://purl.obolibrary.org/obo/PATO_0001397,PATO:0001397,PATO:0001397,cellular potency,A cellular quality that arises by virtue of whether the bearer's disposition to differentiate into one or more mature cell types.,,,
http://purl.obolibrary.org/obo/PATO_0002541,PATO:0002541,PATO:0002541,homeostatic,Pertaining to the ability or tendency of an organism or cell to maintain internal equilibrium by adjusting its physiological processes.,,,
http://purl.obolibrary.org/obo/PATO_0002351,PATO:0002351,PATO:0002351,fleshy,A structural quality inhering in a bearer by virtue of the bearer resembling or containing flesh.,,,
http://purl.obolibrary.org/obo/PATO_0002161,PATO:0002161,PATO:0002161,bicornuate,Having two horns or horn-shaped branches.,,,
http://purl.obolibrary.org/obo/PATO_0005012,PATO:0005012,PATO:0005012,complete structure,A structural quality inhering in a bearer by virtue of the bearer being fully formed compared to entities lacking parts.,,,
http://purl.obolibrary.org/obo/PATO_0000836,PATO:0000836,PATO:0000836,obsolete auditory ability value,,true,,
http://purl.obolibrary.org/obo/PATO_0000646,PATO:0000646,PATO:0000646,malformed,A morphological quality inhering in a bearer by virtue of the bearer's being distorted during formation.,,,
http://purl.obolibrary.org/obo/PATO_0000456,PATO:0000456,PATO:0000456,obsolete abstract,,true,,
http://purl.obolibrary.org/obo/PATO_0001600,PATO:0001600,PATO:0001600,posteriorly rotated,A rotation quality inhering in a bearer by virtue of being rotated towards the rear of organism.,,,
http://purl.obolibrary.org/obo/PATO_0002504,PATO:0002504,PATO:0002504,posterodorsal orientation,An orientation quality inhering in a bearer by virtue of the bearer having a position that is directed posterodorsally.,,,
http://purl.obolibrary.org/obo/PATO_0000266,PATO:0000266,PATO:0000266,obsolete absolute visual_acuity,,true,,
http://purl.obolibrary.org/obo/PATO_0001410,PATO:0001410,PATO:0001410,striated,"A shape quality inhering in a bearer by virtue of the bearer's being marked by narrow lines or grooves, usually parallel.",,,
http://purl.obolibrary.org/obo/PATO_0002314,PATO:0002314,PATO:0002314,ligamentous,"Having the nature or characteristic of, a ligament; composed of the tissue proper to ligaments.",,,
http://purl.obolibrary.org/obo/PATO_0000076,PATO:0000076,PATO:0000076,obsolete regulation,,true,,
http://purl.obolibrary.org/obo/PATO_0001220,PATO:0001220,PATO:0001220,obsolete angle_unit,,true,,
http://purl.obolibrary.org/obo/PATO_0002124,PATO:0002124,PATO:0002124,laminar,A quality inhering in a bearer by virtue of the bearer's processing the form of a thin plate sheet or layer.,,,
http://purl.obolibrary.org/obo/PATO_0001030,PATO:0001030,PATO:0001030,flux,A physical quality that exists by virtue of the rate of flow of the bearer across a given surface.,,,
http://purl.obolibrary.org/obo/PATO_0001962,PATO:0001962,PATO:0001962,involute,A curled quality inhering in a bearer by virtue of the bearer's edges of its surface being rolled inwards spirally on each side.,,,
http://purl.obolibrary.org/obo/PATO_0001772,PATO:0001772,PATO:0001772,surrounding,A spatial quality inhering in a bearer by virtue of the bearer's being extended on all sides of another entity simultaneously.,,,
http://purl.obolibrary.org/obo/PATO_0001582,PATO:0001582,PATO:0001582,obsolete relaxational quality,A spatial quality inhering in an inactive muscle or muscle fibers by virtue of the bearer's exhibiting gradual lengthening.,true,,
http://purl.obolibrary.org/obo/PATO_0002486,PATO:0002486,PATO:0002486,multi-organismal process quality,A quality inhering in a process by virtue of that process having two or more organisms as participants.,,,
http://purl.obolibrary.org/obo/PATO_0001392,PATO:0001392,PATO:0001392,endopolyploid,A polyploidy quality inhering in a bearer by virtue of the bearer's chromosome number being increased by endomitosis and for which the degree of ploidy is proportional to the number of times that endomitosis has taken place.,,,
http://purl.obolibrary.org/obo/PATO_0002296,PATO:0002296,PATO:0002296,foveate,"A texture quality inhering in a surface by virtue of the bearer's being marked by the presence of small, shallow, regular depressions called fovae.",,,
http://purl.obolibrary.org/obo/PATO_0000609,PATO:0000609,PATO:0000609,closure incomplete,A morphological quality inhering in a bearer by virtue of the bearer's affording not completed blocked passage or view.,,,
http://purl.obolibrary.org/obo/PATO_0045094,PATO:0045094,PATO:0045094,west,West is one of the four cardinal directions or points of the compass. It is the opposite direction from east.,,,
http://purl.obolibrary.org/obo/PATO_0000229,PATO:0000229,PATO:0000229,obsolete olfactory,,true,,
http://purl.obolibrary.org/obo/PATO_0000039,PATO:0000039,PATO:0000039,direction,A physical quality inhering in a bearer by virtue of the bearer's orientation in space.,,,
http://purl.obolibrary.org/obo/PATO_0001925,PATO:0001925,PATO:0001925,surface feature shape,A surface shape quality inhering in a bearer by virtue of the bearer's shape of features present on its surface or outer shell.,,,
http://purl.obolibrary.org/obo/PATO_0000831,PATO:0000831,PATO:0000831,obsolete absolute visual acuity value,,true,,
http://purl.obolibrary.org/obo/PATO_0001735,PATO:0001735,PATO:0001735,liquid configuration,A physical quality inhering in a bearer by virtue of the bearer's parts having the arrangement which exhibits characteristics of liquids.,,,
http://purl.obolibrary.org/obo/PATO_0000641,PATO:0000641,PATO:0000641,obsolete deposition defective,,true,,
http://purl.obolibrary.org/obo/PATO_0001545,PATO:0001545,PATO:0001545,inflexible,"A physical quality inhering in a bearer by virtue of the bearer's inability of being turned, bowed, or twisted without breaking.",,,
http://purl.obolibrary.org/obo/PATO_0002449,PATO:0002449,PATO:0002449,posteromedial to,A spatial quality inhering in a bearer by virtue of the bearer's being located toward the rear and mid-line surface of an organism relative to another entity.,,,
http://purl.obolibrary.org/obo/PATO_0000451,PATO:0000451,PATO:0000451,obsolete pilosity value,,true,,
http://purl.obolibrary.org/obo/PATO_0001355,PATO:0001355,PATO:0001355,convex,"A shape quality that obtains by virtue of the bearer having inward facing edges; having a surface or boundary that curves or bulges outward, as the exterior of a sphere.",,,
http://purl.obolibrary.org/obo/PATO_0002259,PATO:0002259,PATO:0002259,adjacent to,A spatial quality inhering in a bearer by virtue of the bearer's being located near in space in relation to another entity.,,,
http://purl.obolibrary.org/obo/PATO_0000261,PATO:0000261,PATO:0000261,maturity,"A quality of a single physical entity which is held by a bearer when the latter exhibits a state of growth, differentiation, or development.",,,
http://purl.obolibrary.org/obo/PATO_0001165,PATO:0001165,PATO:0001165,obsolete urine enzyme composition value,,true,,
http://purl.obolibrary.org/obo/PATO_0002069,PATO:0002069,PATO:0002069,unstratified,A spatial pattern inhering in a bearer by virtue of the bearer's lacking a layered configuration.,,,
http://purl.obolibrary.org/obo/PATO_0045057,PATO:0045057,PATO:0045057,normal perimeter,A perimeter which is relatively normal or average,,,
http://purl.obolibrary.org/obo/PATO_0015008,PATO:0015008,PATO:0015008,distensibility,A quality inhering in a bearer by virtue of the extent to which the bearer is capable of being stretched or swollen.,,,
http://purl.obolibrary.org/obo/PATO_0002481,PATO:0002481,PATO:0002481,oblique orientation,An orientation quality inhering in a bearer by virtue of the bearer having a slanting direction or position : neither perpendicular nor parallel.,,,
http://purl.obolibrary.org/obo/PATO_0002291,PATO:0002291,PATO:0002291,agenesis,Absence of a tissue or organ due to failure to develop.,,,
http://purl.obolibrary.org/obo/PATO_0000604,PATO:0000604,PATO:0000604,obsolete orientation value,,true,,
http://purl.obolibrary.org/obo/PATO_0000414,PATO:0000414,PATO:0000414,unbranched,A branchiness quality inhering in a bearer by virtue of the bearer's lacking branches.,,,
http://purl.obolibrary.org/obo/PATO_0001318,PATO:0001318,PATO:0001318,indiscriminate,A discrimination quality in a bearer by virtue of the bearer's being incapable perceiving differences between two or more stimuli.,,,
http://purl.obolibrary.org/obo/PATO_0000224,PATO:0000224,PATO:0000224,obsolete motor function,,true,,
http://purl.obolibrary.org/obo/PATO_0001128,PATO:0001128,PATO:0001128,obsolete absolute work value,,true,,
http://purl.obolibrary.org/obo/PATO_0000034,PATO:0000034,PATO:0000034,obsolete protein concentration,,true,,
http://purl.obolibrary.org/obo/PATO_0000966,PATO:0000966,PATO:0000966,obsolete symmetry value,,true,,
http://purl.obolibrary.org/obo/PATO_0000776,PATO:0000776,PATO:0000776,obsolete memory value,,true,,
http://purl.obolibrary.org/obo/PATO_0001920,PATO:0001920,PATO:0001920,mislocalised ventrally,A positional quality inhering in a bearer by virtue of the bearer's being positioned towards the abdomen of an organism.,,,
http://purl.obolibrary.org/obo/PATO_0000586,PATO:0000586,PATO:0000586,increased size,A size quality which is relatively high.,,,
http://purl.obolibrary.org/obo/PATO_0001730,PATO:0001730,PATO:0001730,deciduous (generic),A quality inhering in a bearer by virtue of the bearer's disposition to shed body parts.,,,
http://purl.obolibrary.org/obo/PATO_0000396,PATO:0000396,PATO:0000396,severe intensity,An intensity which is extremely bad or unpleasant in type or degree or effect or force.,,,
http://purl.obolibrary.org/obo/PATO_0001540,PATO:0001540,PATO:0001540,glutinous,An amylose composition quality inhering in an bearer by virtue of the bearer's having negligible or no amylose content.,,,
http://purl.obolibrary.org/obo/PATO_0002444,PATO:0002444,PATO:0002444,mineralized,A composition quality inhering in a bearer by virtue of the bearer's being composed of or possessing inorganic material.,,,
http://purl.obolibrary.org/obo/PATO_0001350,PATO:0001350,PATO:0001350,angular acceleration,A physical quality inhering in a bearer by virtue of the rate of change of the bearer's angular velocity.,,,
http://purl.obolibrary.org/obo/PATO_0002254,PATO:0002254,PATO:0002254,flattened,A quality inhering in a bearer by virtue of the bearer's surface becoming more extended in a plane.,,,
http://purl.obolibrary.org/obo/PATO_0001160,PATO:0001160,PATO:0001160,obsolete unconcentrated,,true,,
http://purl.obolibrary.org/obo/PATO_0002064,PATO:0002064,PATO:0002064,fenestrated,A structure quality inhering in a bearer by virtue of the bearer's delimited by a surface with holes.,,,
http://purl.obolibrary.org/obo/PATO_0045052,PATO:0045052,PATO:0045052,normal depth,A depth quality which is relatively normal or average,,,
http://purl.obolibrary.org/obo/PATO_0015003,PATO:0015003,PATO:0015003,decreased efficacy,A decrease in the ability of a process to produce its output.,,,
http://purl.obolibrary.org/obo/PATO_0000929,PATO:0000929,PATO:0000929,obsolete light intensivity sensitivity,,true,,
http://purl.obolibrary.org/obo/PATO_0000739,PATO:0000739,PATO:0000739,obsolete absolute enzyme function value,,true,,
http://purl.obolibrary.org/obo/PATO_0000549,PATO:0000549,PATO:0000549,obsolete far red light sensitivity value,,true,,
http://purl.obolibrary.org/obo/PATO_0000359,PATO:0000359,PATO:0000359,obsolete water content value,,true,,
http://purl.obolibrary.org/obo/PATO_0001503,PATO:0001503,PATO:0001503,simple,A complexity quality in a bearer by virtue of the bearer's having few parts or being complicated or compound.,,,
http://purl.obolibrary.org/obo/PATO_0002407,PATO:0002407,PATO:0002407,indurated,Having become firm or hard especially by increase of fibrous elements.,,,
http://purl.obolibrary.org/obo/PATO_0000169,PATO:0000169,PATO:0000169,viability,An organismal quality inhering in a bearer or a population by virtue of the bearer's disposition to survive and develop normally or the number of surviving individuals in a given population.,,,
http://purl.obolibrary.org/obo/PATO_0001313,PATO:0001313,PATO:0001313,invariant temperature,A variability quality inhering in a bearer by virtue of the bearer's lacking or not exhibiting variation of temperature.,,,
http://purl.obolibrary.org/obo/PATO_0002217,PATO:0002217,PATO:0002217,nitrated,"A molecular quality inhering in a bearer by virtue of the bearer's being combined, or impregnated, with nitric acid, or some of its compounds.",,,
http://purl.obolibrary.org/obo/PATO_0001123,PATO:0001123,PATO:0001123,obsolete relative power value,,true,,
http://purl.obolibrary.org/obo/PATO_0002027,PATO:0002027,PATO:0002027,osmolality,A concentration quality inhering in a bearer by virtue of the bearer's amount of osmoles of solute per kilogram of solvent.,,,
http://purl.obolibrary.org/obo/PATO_0045015,PATO:0045015,PATO:0045015,normal efficiency,An efficiency which is relatively normal or average.,,,
http://purl.obolibrary.org/obo/PATO_0000961,PATO:0000961,PATO:0000961,obsolete relative opacity value,,true,,
http://purl.obolibrary.org/obo/PATO_0001865,PATO:0001865,PATO:0001865,spheroid,A convex 3-D shape quality inhering in a bearer by virtue of the bearer's having a quadric surface in three dimensions obtained by rotating an ellipse about one of its principal axes. Includes spheres and oblate/prolate spheroids.,,,
http://purl.obolibrary.org/obo/PATO_0000771,PATO:0000771,PATO:0000771,aversion,A preference quality in a bearer by virtue of the bearer's disliking a perceived stimulus.,,,
http://purl.obolibrary.org/obo/PATO_0001675,PATO:0001675,PATO:0001675,decreased efficiency,An efficiency which is relatively low.,,,
http://purl.obolibrary.org/obo/PATO_0055002,PATO:0055002,PATO:0055002,increased spatial extent of a process,"A spatial distribution of a process in which the process occupies a greater length, area, or volume than the reference process. For example, heterochromatin may form over a shorter length of a chromosome in a mutant than in wild type.",,,
http://purl.obolibrary.org/obo/PATO_0000581,PATO:0000581,PATO:0000581,obsolete relative weight value,,true,,
http://purl.obolibrary.org/obo/PATO_0002389,PATO:0002389,PATO:0002389,procumbent,Growing horizontal to the ground without setting roots.,,,
http://purl.obolibrary.org/obo/PATO_0001485,PATO:0001485,PATO:0001485,condensed,A structural quality inhering in a bearer by virtue of the bearer's being thicker or more closely packed together; pressed tightly together.,,,
http://purl.obolibrary.org/obo/PATO_0000391,PATO:0000391,PATO:0000391,obsolete intense,,true,,
http://purl.obolibrary.org/obo/PATO_0001295,PATO:0001295,PATO:0001295,albedo,A reflective quality restricted to a particular wavelength.,,,
http://purl.obolibrary.org/obo/PATO_0002199,PATO:0002199,PATO:0002199,meltability,A quality which inheres in a substance by virtue of the ease with which the substance can be changed from a solid to a liquid state especially by the application of heat.,,,
